Estado,Municipio,Parroquia,Centro,Número de Electores escrutados.,Número de Actas Procesadas.,Número total de Votos Nulos.,Número Total de Votantes que votaron realmente.,HUGO CHAVEZ,Número total de Votos Válidos.,ORLANDO CHIRINO,REINA SEQUERA,LUIS REYES,MARIA BOLIVAR,HENRIQUE CAPRILES RADONSKI,Número de Votos Escrutados.
EDO. MIRANDA,MP. INDEPENDENCIA,PQ. STA TERESA DEL TUY,ESCUELA BASICA ESTADO PORTUGUESA,868,2,19,727,463,708,0,1,0,0,244,727
EDO. MIRANDA,MP. INDEPENDENCIA,PQ. STA TERESA DEL TUY,ESCUELA BASICA NACIONAL JUAN ANTONIO ROMAN VALECILLOS,3268,6,47,2654,1769,2607,1,16,2,3,816,2654
EDO. MIRANDA,MP. INDEPENDENCIA,PQ. STA TERESA DEL TUY,LICEO NACIONAL  DOS LAGUNAS,2584,5,51,2113,1650,2062,0,7,3,0,402,2113
EDO. MIRANDA,MP. INDEPENDENCIA,PQ. STA TERESA DEL TUY,UNIDAD EDUCATIVA ESTADAL SANTA BARBARA,1291,3,22,1064,903,1042,0,4,0,0,135,1064
EDO. MIRANDA,MP. INDEPENDENCIA,PQ. STA TERESA DEL TUY,CENTRO CULTURAL  JUAN ESPAÑA,1629,3,29,1336,935,1307,0,2,0,0,370,1336
EDO. MIRANDA,MP. INDEPENDENCIA,PQ. STA TERESA DEL TUY,UNIDAD EDUCATIVA PRIVADA CONGRESO DE ANGOSTURA,1556,3,23,1279,760,1256,0,4,0,0,492,1279
EDO. MIRANDA,MP. INDEPENDENCIA,PQ. STA TERESA DEL TUY,UNIDAD EDUCATIVA SEUCE,2028,4,35,1536,1393,1501,4,6,4,0,94,1536
EDO. MIRANDA,MP. INDEPENDENCIA,PQ. STA TERESA DEL TUY,UNIVERSIDAD NACIONAL EXPERIMENTAL SIMON RODRIGUEZ,1473,3,21,1229,670,1208,0,3,0,0,535,1229
EDO. MIRANDA,MP. INDEPENDENCIA,PQ. STA TERESA DEL TUY,UNIDAD EDUCATIVA PRIVADA FRANCISCO TAMAYO,1038,2,20,847,474,827,0,1,1,0,351,847
EDO. MIRANDA,MP. INDEPENDENCIA,PQ. STA TERESA DEL TUY,ESCUELA BASICA NACIONAL CIUDAD LOZADA,3576,7,40,2833,2210,2793,0,10,4,1,568,2833
EDO. MIRANDA,MP. INDEPENDENCIA,PQ. STA TERESA DEL TUY,CENTRO DE EDUCACION INICIAL CIUDAD LOZADA,492,1,5,378,315,373,0,1,0,1,56,378
EDO. MIRANDA,MP. INDEPENDENCIA,PQ. STA TERESA DEL TUY,ESCUELA BASICA NACIONAL 24 DE JUNIO,4129,8,68,3407,2650,3339,1,13,4,2,669,3407
EDO. MIRANDA,MP. INDEPENDENCIA,PQ. STA TERESA DEL TUY,UNIDAD EDUCATIVA NACIONAL SAN JOSE DE RIO CHICO,2913,5,85,2311,1473,2226,2,12,2,2,735,2311
EDO. MIRANDA,MP. INDEPENDENCIA,PQ. STA TERESA DEL TUY,UNIDAD EDUCATIVA ESTADAL SIMON BOLIVAR,338,1,6,280,248,274,1,0,0,0,25,280
EDO. MIRANDA,MP. INDEPENDENCIA,PQ. STA TERESA DEL TUY,CENTRO DE EDUCACION INICIAL NACIONAL  EZEQUIEL ZAMORA PREESCOLAR,408,1,10,345,244,335,0,3,0,0,88,345
EDO. MIRANDA,MP. INDEPENDENCIA,PQ. STA TERESA DEL TUY,UNIDAD EDUCATIVA NACIONAL  DOLORES GONZALEZ,1883,4,36,1520,808,1484,0,6,0,2,668,1520
EDO. MIRANDA,MP. INDEPENDENCIA,PQ. STA TERESA DEL TUY,UNIDAD EDUCATIVA ESTADAL MIGUEL HERNANDEZ,440,1,3,393,335,390,1,4,0,0,50,393
EDO. MIRANDA,MP. INDEPENDENCIA,PQ. STA TERESA DEL TUY,UNIDAD EDUCATIVA ESTADAL 15 DE OCTUBRE,1548,3,29,1273,1010,1244,0,1,1,0,232,1273
EDO. MIRANDA,MP. INDEPENDENCIA,PQ. STA TERESA DEL TUY,LICEO PRIVADO JOSE LEONARDO CHIRINOS,377,1,1,311,168,310,0,1,0,0,141,311
EDO. MIRANDA,MP. INDEPENDENCIA,PQ. STA TERESA DEL TUY,UNIDAD EDUCATIVA PRIVADA FRANCISCO LINARES ALCANTARA,1304,3,18,1068,638,1050,0,4,1,0,407,1068
EDO. MIRANDA,MP. INDEPENDENCIA,PQ. STA TERESA DEL TUY,CONCENTRACION RURAL MOROCOPITO,532,1,6,414,342,408,1,3,1,0,61,414
EDO. MIRANDA,MP. INDEPENDENCIA,PQ. STA TERESA DEL TUY,PREESCOLAR LAS CAMPANITAS,1704,3,25,1433,1112,1408,0,1,1,0,294,1433
EDO. MIRANDA,MP. INDEPENDENCIA,PQ. STA TERESA DEL TUY,UNIDAD EDUCATIVA PRIVADA AGUSTIN AVELEDO,3374,6,38,2857,1175,2819,1,15,1,2,1625,2857
EDO. MIRANDA,MP. INDEPENDENCIA,PQ. STA TERESA DEL TUY,UNIDAD EDUCATIVA ESTADAL PEDRO RODRIGUEZ VALDIVIEZO,3631,7,85,2917,2391,2832,2,12,3,1,423,2917
EDO. MIRANDA,MP. INDEPENDENCIA,PQ. STA TERESA DEL TUY,GRUPO ESCOLAR EZEQUIEL ZAMORA,3330,6,36,2617,1559,2581,0,9,1,1,1011,2617
EDO. MIRANDA,MP. INDEPENDENCIA,PQ. EL CARTANAL,CENTRO DE EDUCACION INICIAL ABILIO REYES PREESCOLAR,679,2,11,558,417,547,0,4,0,0,126,558
EDO. MIRANDA,MP. INDEPENDENCIA,PQ. EL CARTANAL,LICEO BOLIVARIANO CARTANAL II,4736,9,59,3846,2875,3787,1,21,2,3,885,3846
EDO. MIRANDA,MP. INDEPENDENCIA,PQ. EL CARTANAL,UNIDAD EDUCATIVA ESTADAL BOLIVARIANA AGUSTINA MARTINA BLANCO,837,2,6,724,676,718,0,2,0,0,40,724
EDO. MIRANDA,MP. INDEPENDENCIA,PQ. EL CARTANAL,UNIDAD EDUCATIVA ESTADAL CARTANAL I,3399,6,53,2748,2045,2695,0,13,2,2,633,2748
EDO. MIRANDA,MP. INDEPENDENCIA,PQ. EL CARTANAL,ESCUELA BASICA NACIONAL CARTANAL  VICENTE EMILIO  SOJO,6589,12,91,5510,4068,5419,1,33,5,3,1309,5510
EDO. MIRANDA,MP. INDEPENDENCIA,PQ. EL CARTANAL,ESCUELA BASICA NACIONAL PEDRO VICENTE NU EZ,2609,5,65,2251,1423,2186,0,12,1,0,750,2251
EDO. MIRANDA,MP. INDEPENDENCIA,PQ. EL CARTANAL,CONCENTRACION NACIONAL 3626,2463,5,54,2107,1545,2053,1,10,0,2,495,2107
EDO. MIRANDA,MP. INDEPENDENCIA,PQ. EL CARTANAL,ESCUELA BASICA NACIONAL CARTANAL II,4039,7,81,3332,2359,3251,2,11,4,3,872,3332
EDO. MIRANDA,MP. INDEPENDENCIA,PQ. EL CARTANAL,CENTRO DE EDUCACION INICIAL NACIONAL MARVELIA HERNANDEZ FERRER,171,1,2,151,133,149,0,0,0,0,16,151
EDO. MIRANDA,MP. INDEPENDENCIA,PQ. EL CARTANAL,CENTRO DE EDUCACION INICIAL NACIONAL  DOS LAGUNAS PREESCOLAR,245,1,6,200,141,194,0,0,0,0,53,200
EDO. MIRANDA,MP. INDEPENDENCIA,PQ. EL CARTANAL,UNIDAD EDUCATIVA NACIONAL 12 DE MARZO,1981,4,54,1653,1275,1599,1,11,0,1,311,1653
EDO. MIRANDA,MP. INDEPENDENCIA,PQ. EL CARTANAL,UNIDAD EDUCATIVA ESTADAL MANUEL DIAZ RODRIGUEZ,1472,3,21,1141,919,1120,0,8,1,1,191,1141
EDO. MIRANDA,MP. INDEPENDENCIA,PQ. EL CARTANAL,UNIDAD EDUCATIVA NACIONAL GUILLERMO COVA,5875,11,130,4931,3396,4801,0,23,3,10,1369,4931
EDO. MIRANDA,MP. INDEPENDENCIA,PQ. EL CARTANAL,ESCUELA BASICA ESTADAL CARTANAL II (LAS CASITAS),1162,2,21,985,721,964,0,4,0,2,237,985
EDO. MIRANDA,MP. INDEPENDENCIA,PQ. EL CARTANAL,CENTRO EDUCACION INICIAL BOLIVARIANO TITO SALAS,355,1,6,299,244,293,0,1,1,1,46,299
EDO. MIRANDA,MP. INDEPENDENCIA,PQ. EL CARTANAL,ESCUELA BASICA DOS LAGUNAS 2 LUIS BELTRAN PRIETO FIGUEROA,3125,6,57,2546,1754,2489,0,14,1,0,720,2546
EDO. MIRANDA,MP. INDEPENDENCIA,PQ. EL CARTANAL,ESCUELA BASICA DOS LAGUNAS RAUL LEONI,2966,5,59,2465,1819,2406,1,13,0,2,571,2465
EDO. MIRANDA,MP. BARUTA,PQ. BARUTA,ESCUELA  MUNICIPAL MONSEÑOR LUCAS GUILLERMO CASTILLO,1431,3,23,1127,407,1104,1,4,2,0,690,1127
EDO. MIRANDA,MP. BARUTA,PQ. BARUTA,UNIDAD EDUCATIVA INSTITUTO ARTURO MICHELENA,3093,6,11,2385,195,2374,0,2,0,2,2175,2385
EDO. MIRANDA,MP. BARUTA,PQ. BARUTA,LICEO NACIONAL JOSE ALBERTO VELANDIA,2403,5,9,1952,195,1943,0,1,0,0,1747,1952
EDO. MIRANDA,MP. BARUTA,PQ. BARUTA,LICEO LOS ARCOS,3827,7,20,3066,119,3046,0,1,0,1,2925,3066
EDO. MIRANDA,MP. BARUTA,PQ. BARUTA,UNIDAD EDUCATIVA COLEGIO LAS CUMBRES,5717,10,16,4257,314,4241,1,11,0,1,3914,4257
EDO. MIRANDA,MP. BARUTA,PQ. BARUTA,UNIDAD EDUCATIVA COLEGIO EMIL FRIEDMAN,3249,6,12,2492,117,2480,0,3,0,0,2360,2492
EDO. MIRANDA,MP. BARUTA,PQ. BARUTA,INSTITUTO LEOPARDI,3197,6,12,2231,266,2219,0,8,0,2,1943,2231
EDO. MIRANDA,MP. BARUTA,PQ. BARUTA,UNIDAD EDUCATIVA NACIONAL SOROCAIMA,2122,4,12,1585,215,1573,0,5,3,0,1350,1585
EDO. MIRANDA,MP. BARUTA,PQ. BARUTA,CASA DE TODOS Y JUSTICIA DE PAZ,1872,4,24,1539,578,1515,0,4,0,1,932,1539
EDO. MIRANDA,MP. BARUTA,PQ. BARUTA,UNIDAD EDUCATIVA COLEGIO LOS RISCOS,3430,6,13,2584,281,2571,0,3,1,1,2285,2584
EDO. MIRANDA,MP. BARUTA,PQ. BARUTA,INSTITUTO UNIVERSITARIO DE TECNOLOGIA INDUSTRIAL RODOLFO LOERO ARISMENDI,280,1,3,252,76,249,0,0,0,1,172,252
EDO. MIRANDA,MP. BARUTA,PQ. BARUTA,COMPLEJO EDUCATIVO PRIVADO INSTITUTO ESCUELA,10093,19,28,7826,377,7798,1,7,1,4,7408,7826
EDO. MIRANDA,MP. BARUTA,PQ. BARUTA,UNIDAD EDUCATIVA FE Y ALEGRIA COLEGIO MONTERREY,2746,5,43,2275,882,2232,0,4,1,2,1343,2275
EDO. MIRANDA,MP. BARUTA,PQ. BARUTA,UNIDAD EDUCATIVA NACIONAL REPUBLICA DE INDONESIA,3168,6,26,2472,544,2446,1,4,0,2,1895,2472
EDO. MIRANDA,MP. BARUTA,PQ. BARUTA,UNIDAD EDUCATIVA CENTRO DE EDUCACION ACTIVA MARIA MONTESSORI,2135,4,9,1734,93,1725,0,2,0,0,1630,1734
EDO. MIRANDA,MP. BARUTA,PQ. BARUTA,INSTITUTO UNIVERSITARIO DE NUEVAS PROFESIONES,117,1,4,91,17,87,0,0,0,0,70,91
EDO. MIRANDA,MP. BARUTA,PQ. BARUTA,CENTRO VENEZOLANO AMERICANO,4084,8,30,2930,494,2900,2,8,2,3,2391,2930
EDO. MIRANDA,MP. BARUTA,PQ. BARUTA,UNIDAD EDUCATIVA COLEGIO LA CONCEPCION,5541,10,42,4340,383,4298,0,8,1,3,3903,4340
EDO. MIRANDA,MP. BARUTA,PQ. BARUTA,PRE ESCOLAR NUESTRA SEÑORA DEL ROSARIO,4427,8,71,3505,1418,3434,1,10,2,4,1999,3505
EDO. MIRANDA,MP. BARUTA,PQ. BARUTA,COLEGIO DE MEDICOS DEL DISTRITO METROPOLITANO DE CARACAS,3924,7,14,3138,255,3124,0,2,0,2,2865,3138
EDO. MIRANDA,MP. BARUTA,PQ. BARUTA,COLEGIO SANTO TOMAS DE VILLANUEVA,4990,9,31,3476,209,3445,0,1,0,4,3231,3476
EDO. MIRANDA,MP. BARUTA,PQ. BARUTA,UNIDAD EDUCATIVA RURAL MANUELITA SAENZ,714,2,15,574,402,559,0,2,0,1,154,574
EDO. MIRANDA,MP. BARUTA,PQ. BARUTA,CENTRO EDUCATIVO ASOCIACION PROFESORES UNIVERSIDAD CENTRAL DE VENEZUELA  (CEAPUCV),1827,4,14,1362,206,1348,0,2,0,3,1137,1362
EDO. MIRANDA,MP. BARUTA,PQ. BARUTA,ASOCIACION DESARROLLO INTEGRAL COMUNITARIO,1565,3,11,1210,417,1199,0,1,0,1,780,1210
EDO. MIRANDA,MP. BARUTA,PQ. BARUTA,UNIDAD EDUCATIVA INICIAL SIMONCITO EZEQUIEL ZAMORA,1135,2,11,1051,1012,1040,0,2,0,0,26,1051
EDO. MIRANDA,MP. BARUTA,PQ. BARUTA,ESCUELA BASICA NACIONAL HERMANAS MARIA LORENZA,1185,2,8,919,156,911,0,4,0,0,751,919
EDO. MIRANDA,MP. BARUTA,PQ. BARUTA,UNIDAD EDUCATIVA PRIVADA COLEGIO ALTO PRADO,3582,7,8,2840,184,2832,0,1,0,1,2646,2840
EDO. MIRANDA,MP. BARUTA,PQ. BARUTA,UNIDAD EDUCATIVA JOSE TADEO MONAGAS,3329,6,70,2717,1940,2647,4,8,3,3,689,2717
EDO. MIRANDA,MP. BARUTA,PQ. BARUTA,UNIDAD EDUCATIVA COLEGIO NUESTRA SEÑORA DE LA CONSOLACION,1496,3,7,1212,124,1205,0,1,0,0,1080,1212
EDO. MIRANDA,MP. BARUTA,PQ. BARUTA,INSTITUTO DIDACTICO ANTONIO JOSE DE SUCRE,1669,3,6,1272,95,1266,0,2,0,1,1168,1272
EDO. MIRANDA,MP. BARUTA,PQ. BARUTA,COLEGIO LA CONCORDIA,3468,6,20,2632,362,2612,1,6,0,1,2242,2632
EDO. MIRANDA,MP. BARUTA,PQ. BARUTA,AMBULATORIO URBANO TIPO 1 DOCTOR ANGEL GUEDES,587,1,7,493,182,486,1,2,0,0,301,493
EDO. MIRANDA,MP. BARUTA,PQ. BARUTA,UNIDAD EDUCATIVA COLEGIO FRAY LUIS AMIGO,7090,13,40,5268,619,5228,1,7,2,5,4594,5268
EDO. MIRANDA,MP. BARUTA,PQ. BARUTA,LICEO NACIONAL ALEJO FORTIQUE,4742,9,53,3819,1328,3766,0,14,0,6,2418,3819
EDO. MIRANDA,MP. BARUTA,PQ. BARUTA,UNIDAD EDUCATIVA PRIVADA MINERVA I,807,2,8,641,60,633,0,1,0,0,572,641
EDO. MIRANDA,MP. BARUTA,PQ. BARUTA,COLEGIO MATER SALVATORI,2484,5,10,1892,126,1882,0,2,0,1,1753,1892
EDO. MIRANDA,MP. BARUTA,PQ. BARUTA,JARDIN DE INFANCIA PREESCOLAR MANUEL FELIPE RUGELES,304,1,0,274,189,274,0,2,0,0,83,274
EDO. MIRANDA,MP. BARUTA,PQ. BARUTA,UNIDAD EDUCATIVA ESTADAL LINO DE CLEMENTE,3223,6,23,2580,267,2557,1,3,1,0,2285,2580
EDO. MIRANDA,MP. BARUTA,PQ. BARUTA,UNIDAD EDUCATIVA COLEGIO MADRE MATILDE,2877,5,13,2132,95,2119,0,4,0,0,2020,2132
EDO. MIRANDA,MP. BARUTA,PQ. BARUTA,JARDIN DE INFANCIA DON ROMULO BENTANCOURT,528,1,5,462,247,457,0,0,0,1,209,462
EDO. MIRANDA,MP. BARUTA,PQ. BARUTA,PREESCOLAR GUSTAVO ARISMENDI ITURBE,1214,3,15,995,666,980,0,4,2,1,307,995
EDO. MIRANDA,MP. BARUTA,PQ. BARUTA,ESCUELA MUNICIPAL NUMERO 05 MIGUEL JOSE SANZ,3496,6,65,2866,1255,2801,0,9,4,3,1530,2866
EDO. MIRANDA,MP. BARUTA,PQ. BARUTA,ESCUELA BASICA NACIONAL SANTA CRUZ DEL ESTE,4166,8,55,3302,1785,3247,2,7,1,1,1451,3302
EDO. MIRANDA,MP. BARUTA,PQ. BARUTA,COLEGIO PROMESAS PATRIAS,2984,6,26,2360,387,2334,0,6,0,5,1936,2360
EDO. MIRANDA,MP. BARUTA,PQ. BARUTA,MODULO DE SERVICIO DE OJO DE AGUA,2807,5,52,2271,1298,2219,3,8,1,2,907,2271
EDO. MIRANDA,MP. BARUTA,PQ. BARUTA,PRE ESCOLAR LAS LOMITAS,3104,6,8,2535,141,2527,2,2,0,0,2382,2535
EDO. MIRANDA,MP. BARUTA,PQ. BARUTA,ESCUELA BASICA NACIONAL CENTRO COMUNAL,1358,3,16,1077,597,1061,0,3,1,1,459,1077
EDO. MIRANDA,MP. BARUTA,PQ. BARUTA,CENTRO DE EDUCACION INICIAL MUNICIPAL EL CARMEN,102,1,3,89,48,86,0,0,0,0,38,89
EDO. MIRANDA,MP. BARUTA,PQ. BARUTA,UNIVERSIDAD SIMON BOLIVAR,4556,8,59,3646,763,3587,2,6,1,1,2814,3646
EDO. MIRANDA,MP. BARUTA,PQ. BARUTA,ESCUELA BASICA MUNICIPAL GENERAL JOSE ANTONIO PAEZ,2013,4,24,1639,941,1615,0,3,3,1,667,1639
EDO. MIRANDA,MP. BARUTA,PQ. BARUTA,UNIDAD EDUCATIVA NUESTRA SEÑORA DEL ROSARIO,5533,10,33,4322,523,4289,0,9,0,2,3755,4322
EDO. MIRANDA,MP. BARUTA,PQ. BARUTA,UNIDAD EDUCATIVA COLEGIO LA COROMOTO,1778,3,12,1430,196,1418,0,1,0,2,1219,1430
EDO. MIRANDA,MP. BARUTA,PQ. EL CAFETAL,UNIDAD EDUCATIVA COLEGIO CAURIMARE UNO,1617,3,6,1206,81,1200,0,2,0,1,1116,1206
EDO. MIRANDA,MP. BARUTA,PQ. EL CAFETAL,CAMARA DE INDUSTRIALES DEL ESTADO BOLIVARIANO DE MIRANDA,2727,5,10,1967,154,1957,1,0,0,1,1801,1967
EDO. MIRANDA,MP. BARUTA,PQ. EL CAFETAL,CENTRO ESCOLAR AULA NUEVA,3772,7,11,2933,159,2922,2,2,0,1,2758,2933
EDO. MIRANDA,MP. BARUTA,PQ. EL CAFETAL,INSTITUTO MADISON,1647,3,9,1260,77,1251,0,2,0,2,1170,1260
EDO. MIRANDA,MP. BARUTA,PQ. EL CAFETAL,UNIDAD EDUCATIVA COLEGIO CHAMPAGNAT ASOCIACION CIVIL V.E.A.S.,4701,9,24,3680,197,3656,0,7,1,1,3450,3680
EDO. MIRANDA,MP. BARUTA,PQ. EL CAFETAL,ESCUELA NACIONAL JESUS MARIA ALFARO ZAMORA,4981,9,25,3797,422,3772,0,8,0,2,3340,3797
EDO. MIRANDA,MP. BARUTA,PQ. EL CAFETAL,UNIDAD EDUCATIVA COLEGIO  LOS ARAYANES,1134,2,5,911,122,906,0,0,0,2,782,911
EDO. MIRANDA,MP. BARUTA,PQ. EL CAFETAL,INSTITUTO CENTRO APRENDIZAJE MADISON,1587,3,3,1278,75,1275,0,1,0,0,1199,1278
EDO. MIRANDA,MP. BARUTA,PQ. EL CAFETAL,CENTRO INFANTIL AMERICA,1120,2,3,899,64,896,0,1,0,0,831,899
EDO. MIRANDA,MP. BARUTA,PQ. EL CAFETAL,UNIDAD EDUCATIVA COLEGIO SAN LUIS DE CARACAS,6623,12,30,5047,373,5017,1,3,1,2,4637,5047
EDO. MIRANDA,MP. BARUTA,PQ. EL CAFETAL,ESCUELA BASICA NACIONAL BOLIVARIANA EUTIMIO RIVAS,1309,3,6,981,115,975,0,1,0,1,858,981
EDO. MIRANDA,MP. BARUTA,PQ. EL CAFETAL,UNIDAD EDUCATIVA NACIONAL JOSEFA IRAUSQUIN LOPEZ.,1911,4,3,1419,96,1416,1,2,0,2,1315,1419
EDO. MIRANDA,MP. BARUTA,PQ. EL CAFETAL,UNIDAD EDUCATIVA CHUAO,575,1,3,402,43,399,0,0,0,1,355,402
EDO. MIRANDA,MP. BARUTA,PQ. EL CAFETAL,INSTITUTO CUMBRES DE CARACAS ASOCIACION CIVIL,2166,4,6,1729,62,1723,1,2,0,0,1658,1729
EDO. MIRANDA,MP. BARUTA,PQ. EL CAFETAL,UNIDAD EDUCATIVA COLEGIO EL ANGEL,2446,5,7,1792,105,1785,0,4,1,0,1675,1792
EDO. MIRANDA,MP. BARUTA,PQ. EL CAFETAL,GUARDERIA PRE ESCOLAR VIGERLI,493,1,1,378,46,377,0,0,0,0,331,378
EDO. MIRANDA,MP. BARUTA,PQ. EL CAFETAL,UNIDAD EDUCATIVA NACIONAL FRANCISCO ESPEJO,1375,3,7,1000,88,993,0,0,1,1,903,1000
EDO. MIRANDA,MP. BARUTA,PQ. EL CAFETAL,BIBLIOTECA PUBLICA DOCTOR RAUL LEONI,2984,6,12,2322,225,2310,0,2,0,0,2083,2322
EDO. MIRANDA,MP. BARUTA,PQ. LAS MINAS DE BARUTA,ESCUELA MUNICIPAL JERMAN UBALDO LIRA,1811,4,27,1519,761,1492,0,2,0,3,726,1519
EDO. MIRANDA,MP. BARUTA,PQ. LAS MINAS DE BARUTA,COLEGIO  SANTA ROSA DE LIMA,8621,16,45,6550,485,6505,1,12,2,2,6003,6550
EDO. MIRANDA,MP. BARUTA,PQ. LAS MINAS DE BARUTA,COMPLEJO EDUCATIVO COLEGIO AMERICANO,5672,10,71,4678,1499,4607,1,17,3,0,3087,4678
EDO. MIRANDA,MP. BARUTA,PQ. LAS MINAS DE BARUTA,REGISTRO CIVIL DE LA PARROQUIA LAS MINAS,1983,4,19,1614,728,1595,0,2,1,0,864,1614
EDO. MIRANDA,MP. BARUTA,PQ. LAS MINAS DE BARUTA,UNIDAD EDUCATIVA NACIONAL TITO SALAS,4823,9,56,3785,1978,3729,1,8,2,2,1738,3785
EDO. MIRANDA,MP. BARUTA,PQ. LAS MINAS DE BARUTA,COLEGIO INTERNACIONAL DE CARACAS,3724,7,49,3075,977,3026,1,9,4,2,2033,3075
EDO. MIRANDA,MP. BARUTA,PQ. LAS MINAS DE BARUTA,UNIDAD EDUCATIVA ESTADAL  ADOLFO NAVAS  CORONADO,5222,10,100,4288,2129,4188,0,13,1,2,2043,4288
EDO. MIRANDA,MP. BARUTA,PQ. LAS MINAS DE BARUTA,COLEGIO DE FARMACEUTICOS DISTRITO METROPOLITANO DE CARACAS  Y EL ESTADO MIRANDA,1276,3,3,923,54,920,0,1,0,1,864,923
EDO. MIRANDA,MP. BARUTA,PQ. LAS MINAS DE BARUTA,ESCUELA BASICA NACIONAL  LAS MINITAS,2844,5,28,2205,1182,2177,0,7,0,0,988,2205
EDO. MIRANDA,MP. SIMON BOLIVAR,PQ. S ANTONIO DE YARE,UNIDAD EDUCATIVA NACIONAL 28 DE MARZO,683,2,11,580,462,569,0,1,1,0,105,580
EDO. MIRANDA,MP. SIMON BOLIVAR,PQ. S ANTONIO DE YARE,CENTRO PENITENCIARIO REGION CAPITAL YARE II,104,1,2,24,20,22,0,0,0,0,2,24
EDO. MIRANDA,MP. SIMON BOLIVAR,PQ. S ANTONIO DE YARE,CONCENTRACION ESCOLAR SIN NUMERO PUENTE CARRERA,257,1,7,225,189,218,0,2,0,1,26,225
EDO. MIRANDA,MP. SIMON BOLIVAR,PQ. S ANTONIO DE YARE,CONCENTRACION ESCOLAR SIN NUMERO EL LECHOZAL,219,1,7,171,136,164,0,0,0,0,28,171
EDO. MIRANDA,MP. SIMON BOLIVAR,PQ. S ANTONIO DE YARE,UNIDAD EDUCATIVA ESTADAL SAN ANTONIO DE PADUA,2450,5,50,2003,1589,1953,0,4,1,3,356,2003
EDO. MIRANDA,MP. SIMON BOLIVAR,PQ. S ANTONIO DE YARE,UNIDAD EDUCATIVA ESTADAL ARTURO USLAR PIETRI,2462,5,40,2046,1672,2006,0,17,1,2,314,2046
EDO. MIRANDA,MP. SIMON BOLIVAR,PQ. S ANTONIO DE YARE,UNIDAD EDUCATIVA NACIONAL CACIQUE YARE,377,1,7,315,258,308,0,1,1,1,47,315
EDO. MIRANDA,MP. SIMON BOLIVAR,PQ. SAN FCO DE YARE,ESCUELA BASICA NACIONAL CHACAO,4538,8,81,3774,2477,3693,1,17,2,3,1193,3774
EDO. MIRANDA,MP. SIMON BOLIVAR,PQ. SAN FCO DE YARE,CASA DE LA CULTURA,678,2,7,570,456,563,0,2,0,0,105,570
EDO. MIRANDA,MP. SIMON BOLIVAR,PQ. SAN FCO DE YARE,UNIDAD  EDUCATIVA ESTILITA DE ALZURU,2267,4,33,1828,1415,1795,0,8,2,0,370,1828
EDO. MIRANDA,MP. SIMON BOLIVAR,PQ. SAN FCO DE YARE,UNIDAD EDUCATIVA ESTADAL BOLIVARIANA LA VIRGEN DE COROMOTO,977,2,26,791,668,765,0,2,0,0,95,791
EDO. MIRANDA,MP. SIMON BOLIVAR,PQ. SAN FCO DE YARE,CASA COMUNAL NUESTRA SENORA DE LOUDES,106,1,1,88,68,87,0,0,0,0,19,88
EDO. MIRANDA,MP. SIMON BOLIVAR,PQ. SAN FCO DE YARE,PARADOR TURISTICO SAN FRANCISCO DE YARE,1386,3,20,1128,701,1108,0,6,2,0,399,1128
EDO. MIRANDA,MP. SIMON BOLIVAR,PQ. SAN FCO DE YARE,CENTRO DE EDUCACION INICIAL BENITA RIVAS TORO,510,1,2,464,273,462,0,3,0,0,186,464
EDO. MIRANDA,MP. SIMON BOLIVAR,PQ. SAN FCO DE YARE,UNIDAD EDUCATIVA NACIONAL BOLIVARIANA JOSE TADEO MONAGAS,256,1,4,219,156,215,0,2,0,0,57,219
EDO. MIRANDA,MP. SIMON BOLIVAR,PQ. SAN FCO DE YARE,UNIDAD EDUCATIVA NACIONAL LIBERTADOR,2619,5,79,2193,1447,2114,3,2,1,0,661,2193
EDO. MIRANDA,MP. SIMON BOLIVAR,PQ. SAN FCO DE YARE,UNIDAD EDUCATIVA NACIONAL BOLIVARIANA ESTADO MIRANDA,177,1,3,135,115,132,0,0,0,0,17,135
EDO. MIRANDA,MP. SIMON BOLIVAR,PQ. SAN FCO DE YARE,UNIDAD EDUCATIVA ESTADAL LUISA DE JACOTTE,407,1,9,361,299,352,0,1,1,0,51,361
EDO. MIRANDA,MP. SIMON BOLIVAR,PQ. SAN FCO DE YARE,CONCENTRACION ESCOLAR SIN NUMERO CAMBAMBE,969,2,23,813,631,790,0,2,0,0,157,813
EDO. MIRANDA,MP. SIMON BOLIVAR,PQ. SAN FCO DE YARE,UNIDAD EDUCATIVA ESTADAL BENITA RIBAS TORO,2308,4,29,2048,850,2019,0,6,0,0,1163,2048
EDO. MIRANDA,MP. SIMON BOLIVAR,PQ. SAN FCO DE YARE,UNIDAD EDUCATIVA PRIVADA CORONEL ANTONIO NICOLAS BRICENO,217,1,6,189,142,183,0,0,0,0,41,189
EDO. MIRANDA,MP. SIMON BOLIVAR,PQ. SAN FCO DE YARE,UNIDAD EDUCATIVA ESTADAL QUEBRADA SECA,1112,2,29,928,672,899,0,4,0,3,220,928
EDO. MIRANDA,MP. SIMON BOLIVAR,PQ. SAN FCO DE YARE,UNIDAD EDUCATIVA LOS ANILES,677,2,8,584,460,576,0,2,0,3,111,584
EDO. MIRANDA,MP. PLAZA,PQ. GUARENAS,CENTRO DE EDUCACIÓN INICIAL DOÑA VIRGINIA BELLO DE BETANCOURT,391,1,8,341,217,333,0,1,0,1,114,341
EDO. MIRANDA,MP. PLAZA,PQ. GUARENAS,CASA COMUNAL PINAL II PARTE ALTA,276,1,1,260,234,259,0,0,1,0,24,260
EDO. MIRANDA,MP. PLAZA,PQ. GUARENAS,ESCUELA MARTIN VERA GUERRA,1524,3,18,1339,875,1321,0,6,0,1,439,1339
EDO. MIRANDA,MP. PLAZA,PQ. GUARENAS,UNIDAD EDUCATIVA NACIONAL BOLIVARIANA MIGUEL OTERO SILVA,6052,11,198,4809,3534,4611,1,15,3,6,1052,4809
EDO. MIRANDA,MP. PLAZA,PQ. GUARENAS,ESCUELA NACIONAL GRADUADA JUDITH DALO SANDON,2919,5,62,2429,1586,2367,1,6,2,1,771,2429
EDO. MIRANDA,MP. PLAZA,PQ. GUARENAS,ESCUELA TECNICA INDUSTRIAL ROBINSONIANA RUBEN GONZALEZ,3001,6,37,2542,1326,2505,0,11,0,1,1167,2542
EDO. MIRANDA,MP. PLAZA,PQ. GUARENAS,CENTRO DE EDUCACIÓN INICIAL  LOS AZULEJOS,336,1,7,311,212,304,0,1,0,1,90,311
EDO. MIRANDA,MP. PLAZA,PQ. GUARENAS,CIUDAD DE LOS MUCHACHOS FE Y ALEGRIA,1083,2,8,944,585,936,0,2,0,1,348,944
EDO. MIRANDA,MP. PLAZA,PQ. GUARENAS,ALDEA UNIVERSITARIA CORONELA MANUELITA SAENZ,373,1,4,333,218,329,0,0,0,0,111,333
EDO. MIRANDA,MP. PLAZA,PQ. GUARENAS,CENTRO DE EDUCACIÓN INICIAL NACIONAL   LUCERITO,546,1,10,487,375,477,0,2,1,0,99,487
EDO. MIRANDA,MP. PLAZA,PQ. GUARENAS,CENTRO DE EDUCACION INICIAL TERESA DE LA PARRA,460,1,11,432,288,421,0,0,0,1,132,432
EDO. MIRANDA,MP. PLAZA,PQ. GUARENAS,GRUPO ESCOLAR MENCA DE LEONI II,4916,9,68,4198,2475,4130,0,19,5,6,1625,4198
EDO. MIRANDA,MP. PLAZA,PQ. GUARENAS,CENTRO COMUNAL GUARENAS,2372,4,53,1872,1317,1819,2,7,0,2,491,1872
EDO. MIRANDA,MP. PLAZA,PQ. GUARENAS,GRUPO ESCOLAR RUIZ PINEDA,3870,7,65,3144,1911,3079,0,11,4,1,1152,3144
EDO. MIRANDA,MP. PLAZA,PQ. GUARENAS,ESCUELA  BOLIVARIANA HORACIO REQUENA QUINTERO,218,1,7,192,157,185,0,2,0,0,26,192
EDO. MIRANDA,MP. PLAZA,PQ. GUARENAS,LICEO BOLIVARIANO ANTONIO MARIA PIÑATE,592,1,7,511,324,504,0,0,0,0,180,511
EDO. MIRANDA,MP. PLAZA,PQ. GUARENAS,PRE ESCOLAR YOLANDA MARTINEZ,517,1,5,458,294,453,0,3,0,0,156,458
EDO. MIRANDA,MP. PLAZA,PQ. GUARENAS,CENTRO CULTURAL MAGO,1719,3,33,1426,1075,1393,0,6,0,1,311,1426
EDO. MIRANDA,MP. PLAZA,PQ. GUARENAS,GRUPO ESCOLAR AMBROSIO PLAZA,4518,8,70,3753,2150,3683,0,16,2,1,1514,3753
EDO. MIRANDA,MP. PLAZA,PQ. GUARENAS,COLEGIO PARROQUIAL  JESUS MARIA MARRERO,6636,12,118,5627,2183,5509,0,16,4,4,3302,5627
EDO. MIRANDA,MP. PLAZA,PQ. GUARENAS,ESCUELA RURAL BOLIVARIANA CAMPO ALEGRE 028,187,1,0,167,160,167,0,0,0,0,7,167
EDO. MIRANDA,MP. PLAZA,PQ. GUARENAS,ESCUELA BASICA BOLIVARIANA RICARDO MONTILLA,3754,7,50,3170,1745,3120,4,16,2,5,1348,3170
EDO. MIRANDA,MP. PLAZA,PQ. GUARENAS,CENTRO DE EDUCACIÓN INICIAL  AMBROSIO PLAZA,833,2,16,742,468,726,0,4,0,1,253,742
EDO. MIRANDA,MP. PLAZA,PQ. GUARENAS,UNIVERSIDAD NACIONAL EXPERIMENTAL POLITECNICA LUIS CABALLERO MEJIAS,531,1,9,482,274,473,0,1,0,0,198,482
EDO. MIRANDA,MP. PLAZA,PQ. GUARENAS,LICEO ALONSO ANDREA DE LEDEZMA,3846,7,66,3217,2064,3151,1,11,1,4,1070,3217
EDO. MIRANDA,MP. PLAZA,PQ. GUARENAS,CENTRO DE FORMACIÓN SOCIALISTA INSTITUTO NACIONAL DE CAPACITACIÓN Y EDUCACIÓN SOCIALISTA COMERCIAL,507,1,12,446,296,434,0,1,0,0,137,446
EDO. MIRANDA,MP. PLAZA,PQ. GUARENAS,ESCUELA ESTADAL ROSENDO URPIANO ARMAS,2875,5,55,2375,1764,2320,0,14,2,2,538,2375
EDO. MIRANDA,MP. PLAZA,PQ. GUARENAS,ESCUELA ESTADAL NERY RANGEL DE LOPEZ,1306,3,26,1107,793,1081,0,3,1,0,284,1107
EDO. MIRANDA,MP. PLAZA,PQ. GUARENAS,ESCUELA ESTADAL ABEL GONZALEZ LIMA,926,2,20,802,649,782,0,5,0,0,128,802
EDO. MIRANDA,MP. PLAZA,PQ. GUARENAS,CASA TALLER LUISA CACERES DE ARISMENDI,529,1,10,486,308,476,0,2,0,0,166,486
EDO. MIRANDA,MP. PLAZA,PQ. GUARENAS,UNIDAD EDUCATIVA ADVENTISTA ALEJANDRO OROPEZA CASTILLO,663,2,10,612,286,602,0,1,0,0,315,612
EDO. MIRANDA,MP. PLAZA,PQ. GUARENAS,ESCUELA BASICA EXPERIMENTAL CARMEN CABRILES,2914,5,34,2522,1375,2488,0,15,0,3,1095,2522
EDO. MIRANDA,MP. PLAZA,PQ. GUARENAS,UNIDAD EDUCATIVA BENITO CANONICO,3713,7,64,3114,1534,3050,0,7,0,2,1507,3114
EDO. MIRANDA,MP. PLAZA,PQ. GUARENAS,CENTRO DE EDUCACIÓN INICIAL ESTADAL   CARMEN ESPERANZA GARCÍA,196,1,3,179,149,176,0,0,0,0,27,179
EDO. MIRANDA,MP. PLAZA,PQ. GUARENAS,ESCUELA ESTADAL ANTONIO MARIA PIÑATE,1564,3,34,1251,915,1217,0,5,0,0,297,1251
EDO. MIRANDA,MP. PLAZA,PQ. GUARENAS,ESCUELA ESTADAL BASICA ANITA LLANES,1525,3,37,1240,810,1203,1,12,0,2,378,1240
EDO. MIRANDA,MP. PLAZA,PQ. GUARENAS,GRUPO ESCOLAR SIMON RODRIGUEZ,3402,6,51,2710,1888,2659,3,9,1,2,756,2710
EDO. MIRANDA,MP. PLAZA,PQ. GUARENAS,CENTRO CULTURAL MIGUEL PARRA,3465,7,69,2913,1742,2844,1,16,2,3,1080,2913
EDO. MIRANDA,MP. PLAZA,PQ. GUARENAS,SIMONCITO CIUDAD BELEN,1138,2,22,1045,995,1023,0,1,1,0,26,1045
EDO. MIRANDA,MP. PLAZA,PQ. GUARENAS,UNIDAD EDUCATIVA ANTONIO JOSE ROJAS,1669,3,18,1364,949,1346,0,3,0,0,394,1364
EDO. MIRANDA,MP. PLAZA,PQ. GUARENAS,ESCUELA BASICA NACIONAL LAUDELINO MEJIAS,3101,6,43,2704,1478,2661,0,10,0,5,1168,2704
EDO. MIRANDA,MP. PLAZA,PQ. GUARENAS,COLEGIO SAN NICOLAS DE BARI,9456,17,78,8406,1819,8328,0,25,2,4,6478,8406
EDO. MIRANDA,MP. PLAZA,PQ. GUARENAS,UNIDAD ESTADAL FELIX MANUEL LUCES,1134,2,27,997,785,970,0,4,0,0,181,997
EDO. MIRANDA,MP. PLAZA,PQ. GUARENAS,UNIDAD EDUCATIVA PRIVADA  INSTITUTO PREMILITAR  AURELIO BALDOR,234,1,3,219,127,216,0,0,0,0,89,219
EDO. MIRANDA,MP. PLAZA,PQ. GUARENAS,UNIDAD BASICA EDUCATIVA ALBERTO SEQUIN VERA,2728,5,34,2389,1416,2355,0,9,0,4,926,2389
EDO. MIRANDA,MP. PLAZA,PQ. GUARENAS,UNIDAD EDUCATIVA  REGULO RICO,1532,3,15,1314,1001,1299,0,4,1,0,293,1314
EDO. MIRANDA,MP. PLAZA,PQ. GUARENAS,ESCUELA ESTADAL GRADUADA EULALIA BUROZ,3007,6,52,2556,1839,2504,0,11,0,2,652,2556
EDO. MIRANDA,MP. PLAZA,PQ. GUARENAS,ESCUELA TECNICA COMERCIAL ROBINSONIANA NORBERTO PRADO,3335,6,47,2858,1469,2811,0,13,3,3,1323,2858
EDO. MIRANDA,MP. PLAZA,PQ. GUARENAS,UNIDAD EDUCATIVA NACIONAL ALBERTO LOVERA,137,1,8,128,109,120,0,0,0,0,11,128
EDO. MIRANDA,MP. PLAZA,PQ. GUARENAS,LICEO BOLIVARIANO ANTONIO JOSE DE SUCRE,2062,4,49,1732,963,1683,0,7,1,1,711,1732
EDO. MIRANDA,MP. PLAZA,PQ. GUARENAS,CONCENTRACION GUACARAPA,395,1,4,347,302,343,0,0,0,0,41,347
EDO. MIRANDA,MP. PLAZA,PQ. GUARENAS,ESCUELA BASICA PRIVADA  LIBERTADORA MANUELITA SAENZ,347,1,3,290,220,287,0,1,0,0,66,290
EDO. MIRANDA,MP. PLAZA,PQ. GUARENAS,CASA COMUNAL CIUDAD BELEN,703,2,13,626,594,613,0,1,0,0,18,626
EDO. MIRANDA,MP. PLAZA,PQ. GUARENAS,UNIDAD EDUCATIVA MENCA DE LEONI I,5917,11,90,5041,3052,4951,3,25,2,10,1859,5041
EDO. MIRANDA,MP. PLAZA,PQ. GUARENAS,ESCUELA BASICA ESTADAL LINO BRAVO,1663,3,48,1299,906,1251,1,9,0,0,335,1299
EDO. MIRANDA,MP. PLAZA,PQ. GUARENAS,UNIDAD EDUCATIVA BUEN PASTOR PRESBITERIANO,1434,3,19,1174,752,1155,1,7,1,1,393,1174
EDO. MIRANDA,MP. PLAZA,PQ. GUARENAS,ESCUELA BASICA 14 DE FEBRERO,760,2,24,639,503,615,0,4,0,0,108,639
EDO. MIRANDA,MP. PLAZA,PQ. GUARENAS,UNIDAD EDUCATIVA PRIVADA  VICENTE EMILIO SOJO,536,1,6,490,244,484,0,2,0,0,238,490
EDO. MIRANDA,MP. PLAZA,PQ. GUARENAS,UNIDAD EDUCATIVA ANDRES BELLO,1525,3,11,1443,577,1432,1,8,1,1,844,1443
EDO. MIRANDA,MP. PLAZA,PQ. GUARENAS,SIMONCITO COMUNITARIO CRECIENDO FELIZ,464,1,5,432,292,427,0,1,0,0,134,432
EDO. MIRANDA,MP. PLAZA,PQ. GUARENAS,PRE ESCOLAR LA ESTRELLA,1017,2,29,825,608,796,2,7,0,1,178,825
EDO. MIRANDA,MP. PLAZA,PQ. GUARENAS,CENTRO DE EDUCACION INICIAL IRAMA MARTINEZ DE ORTA,471,1,7,437,354,430,0,2,0,1,73,437
EDO. MIRANDA,MP. PLAZA,PQ. GUARENAS,PRE ESCOLAR TERRAZAS DEL ESTE,1669,3,20,1566,524,1546,0,7,2,1,1012,1566
EDO. MIRANDA,MP. PLAZA,PQ. GUARENAS,COLEGIO CIUDAD CASARAPA,3093,6,23,2871,785,2848,1,10,0,3,2049,2871
EDO. MIRANDA,MP. PLAZA,PQ. GUARENAS,UNIDAD EDUCATIVA COLEGIO CEPA,1048,2,11,909,731,898,0,3,0,0,164,909
EDO. MIRANDA,MP. PLAZA,PQ. GUARENAS,ESCUELA NACIONAL EL TAMARINDO,4063,8,95,3309,2430,3214,0,20,2,1,761,3309
