EDO. MIRANDA,MP. ZAMORA,PQ. GUATIRE,CASA PARROQUIAL DE GUATIRE,1443,3,28,1163,618,1135,1,8,1,3,504,1163
EDO. MIRANDA,MP. ZAMORA,PQ. GUATIRE,COLEGIO SAN JOSE,329,1,7,296,113,289,0,1,0,0,175,296
EDO. MIRANDA,MP. ZAMORA,PQ. GUATIRE,ESCUELA ESTADAL ESTADO MONAGAS,3358,6,78,2713,2044,2635,0,7,4,0,580,2713
EDO. MIRANDA,MP. ZAMORA,PQ. GUATIRE,ESCUELA NACIONAL EDUARDO CHURION,4409,8,63,3511,2768,3448,0,22,2,1,655,3511
EDO. MIRANDA,MP. ZAMORA,PQ. GUATIRE,INTERNADO JUDICIAL EL RODEO,1219,3,21,336,255,315,0,0,0,0,60,336
EDO. MIRANDA,MP. ZAMORA,PQ. GUATIRE,INSTITUTO DE CICLO BASICO JUAN JOSE ABREU,4810,9,98,3985,2259,3887,0,16,1,3,1608,3985
EDO. MIRANDA,MP. ZAMORA,PQ. GUATIRE,UNIDAD EDUCATIVA EZEQUIEL ZAMORA,713,2,12,652,511,640,0,5,2,1,121,652
EDO. MIRANDA,MP. ZAMORA,PQ. GUATIRE,GRUPO ESCOLAR RAMON ALFONZO BLANCO,2371,5,47,2049,1365,2002,1,10,2,1,623,2049
EDO. MIRANDA,MP. ZAMORA,PQ. GUATIRE,GRUPO ESCOLAR ELIAS CALIXTO POMPA,4066,8,85,3297,1614,3212,0,11,2,1,1584,3297
EDO. MIRANDA,MP. ZAMORA,PQ. GUATIRE,COLEGIO PACAIRIGUA,5888,11,81,5187,2000,5106,0,12,1,5,3088,5187
EDO. MIRANDA,MP. ZAMORA,PQ. GUATIRE,ESCUELA CONCENTRADA ESTADAL NUMERO 266 166,575,1,7,344,293,337,1,5,0,0,38,344
EDO. MIRANDA,MP. ZAMORA,PQ. GUATIRE,COMPLEJO EDUCATIVO ARTISTICO,954,2,23,780,363,757,0,2,1,0,391,780
EDO. MIRANDA,MP. ZAMORA,PQ. GUATIRE,UNIDAD EDUACATIVA BASICA LIGIA GOUBERNIER,1505,3,41,1399,743,1358,0,8,2,1,604,1399
EDO. MIRANDA,MP. ZAMORA,PQ. GUATIRE,UNIDAD EDUCATIVA NUESTRA SEÑORA DEL CAMINO,5657,10,58,5267,948,5209,0,7,1,7,4246,5267
EDO. MIRANDA,MP. ZAMORA,PQ. GUATIRE,UNIDAD EDUCATIVA PRIVADA BELAGUA,2728,5,54,2481,957,2427,0,5,0,4,1461,2481
EDO. MIRANDA,MP. ZAMORA,PQ. GUATIRE,CASA DE LA CULTURA SAN PEDRO,1162,2,22,999,673,977,0,4,2,1,297,999
EDO. MIRANDA,MP. ZAMORA,PQ. GUATIRE,CENTRO DE EDUCACION INICIAL  VICTORIA MACHADO DE PLAZA,361,1,6,322,260,316,0,0,1,0,55,322
EDO. MIRANDA,MP. ZAMORA,PQ. GUATIRE,UNIDAD EDUCATIVA ESTADAL EUGENIO P` DE BELLARD,5655,10,121,4674,3391,4553,2,27,4,2,1127,4674
EDO. MIRANDA,MP. ZAMORA,PQ. GUATIRE,UNIDAD EDUCATIVA BASICA PRE ESCOLAR ARTURO MICHELENA,541,1,16,485,433,469,0,0,1,0,35,485
EDO. MIRANDA,MP. ZAMORA,PQ. GUATIRE,LICEO VICENTE EMILIO SOJO,2529,5,36,2249,1168,2213,0,7,0,2,1036,2249
EDO. MIRANDA,MP. ZAMORA,PQ. GUATIRE,ESCUELA ESTADAL SANTA MARIA GORETTI,8605,16,103,7391,2599,7288,1,30,3,6,4649,7391
EDO. MIRANDA,MP. ZAMORA,PQ. GUATIRE,INTERNADO JUDICIAL EL RODEO II,82,1,0,37,32,37,0,0,0,0,5,37
EDO. MIRANDA,MP. ZAMORA,PQ. GUATIRE,UNIDAD EDUCATIVA PRIVADA  CIUDAD FAJARDO DE GUATIRE,139,1,1,125,61,124,0,0,0,1,62,125
EDO. MIRANDA,MP. ZAMORA,PQ. GUATIRE,ESCUELA ESTADAL  VICENTE EMILIO SOJO,1321,3,38,1060,795,1022,0,3,0,3,221,1060
EDO. MIRANDA,MP. ZAMORA,PQ. GUATIRE,CAPILLA NUESTRA SEÑORA DEL CARMEN,485,1,5,412,364,407,0,2,1,0,40,412
EDO. MIRANDA,MP. ZAMORA,PQ. GUATIRE,LICEO JOSE FRANCISCO BERMUDEZ,2954,6,95,2425,1895,2330,0,7,0,0,428,2425
EDO. MIRANDA,MP. ZAMORA,PQ. GUATIRE,CASA SINDICAL LUIS MORENO,667,2,10,598,367,588,0,4,0,0,217,598
EDO. MIRANDA,MP. ZAMORA,PQ. GUATIRE,ESCUELA BASICA PRIVADA  SAN VICENTE DE PAUL,189,1,4,166,108,162,0,0,0,0,54,166
EDO. MIRANDA,MP. ZAMORA,PQ. GUATIRE,COLEGIO SAN MARTIN DE PORRES,3971,7,38,3442,979,3404,0,11,1,3,2410,3442
EDO. MIRANDA,MP. ZAMORA,PQ. GUATIRE,UNIVERSIDAD NACIONAL EXPERIMENTAL DE LA FUERZA ARMADA NACIONAL  UNEFA,1173,2,26,1073,921,1047,0,1,1,0,124,1073
EDO. MIRANDA,MP. ZAMORA,PQ. GUATIRE,SERVICIO DE PROTECCIÒN INTEGRAL A LA NIÑEZ Y ADOLESCENCIA,944,2,19,824,558,805,0,3,0,0,244,824
EDO. MIRANDA,MP. ZAMORA,PQ. GUATIRE,CONCENTRACION ESTADAL SIN NUMERO ARENALES,1221,3,26,1003,802,977,1,5,0,0,169,1003
EDO. MIRANDA,MP. BRION,PQ. HIGUEROTE,UNIDAD EDUCATIVA ESTADAL INDALECIA MEJIA GARCIA,550,1,10,444,321,434,0,2,0,0,111,444
EDO. MIRANDA,MP. BRION,PQ. HIGUEROTE,UNIDAD EDUCATIVA NUMERO 3 DE JUNIO,524,1,6,464,332,458,1,2,1,0,122,464
EDO. MIRANDA,MP. BRION,PQ. HIGUEROTE,ESCUELA NACIONAL BOLIVARIANA CHIRIMENA,829,2,24,669,401,645,0,5,0,0,239,669
EDO. MIRANDA,MP. BRION,PQ. HIGUEROTE,ESCUELA BASICA CARMEN HELENA SOTO DE TERAN,2233,4,67,1787,1155,1720,0,8,0,2,555,1787
EDO. MIRANDA,MP. BRION,PQ. HIGUEROTE,ESCUELA EL CARMEN GUEDEZ GOPAR,2047,4,40,1643,883,1603,0,6,1,0,713,1643
EDO. MIRANDA,MP. BRION,PQ. HIGUEROTE,UNIDAD EDUCATIVA NUESTRA SEÑORA DEL CARMEN,800,2,9,650,335,641,1,2,1,0,302,650
EDO. MIRANDA,MP. BRION,PQ. HIGUEROTE,ESCUELA BASICA GABRIEL EMILIO MUÑOZ,5009,9,126,4034,2078,3908,0,18,5,1,1806,4034
EDO. MIRANDA,MP. BRION,PQ. HIGUEROTE,CONCENTRACIÓN NACIONAL BOLIVARIANA NUMEROº 19,529,1,4,432,262,428,0,0,0,0,166,432
EDO. MIRANDA,MP. BRION,PQ. HIGUEROTE,UNIDAD EDUCATIVA FERMIN TORO,1697,3,30,1382,826,1352,1,6,0,2,517,1382
EDO. MIRANDA,MP. BRION,PQ. HIGUEROTE,CONCENTRACION ESCOLAR NUMERO 34,382,1,2,280,164,278,0,2,1,1,110,280
EDO. MIRANDA,MP. BRION,PQ. HIGUEROTE,UNIDAD EDUCATIVA AREVALO GONZALEZ,4037,7,106,3242,1686,3136,1,12,1,3,1433,3242
EDO. MIRANDA,MP. BRION,PQ. HIGUEROTE,UNIDAD EDUCATIVA ESTADAL MESA GRANDE,512,1,18,432,294,414,0,1,0,2,117,432
EDO. MIRANDA,MP. BRION,PQ. HIGUEROTE,CENTRO DE EDUCACION INICIAL GABRIEL EMILIO MUÑOZ,1081,2,34,897,511,863,0,4,1,0,347,897
EDO. MIRANDA,MP. BRION,PQ. HIGUEROTE,UNIVERSIDAD PEDAGOGICA ARGELIA LAYA,866,2,27,735,390,708,0,6,1,0,311,735
EDO. MIRANDA,MP. BRION,PQ. CURIEPE,UNIDAD EDUCATIVA JUAN PABLO SOJO,2461,5,52,1926,1223,1874,0,6,3,1,641,1926
EDO. MIRANDA,MP. BRION,PQ. CURIEPE,ESCUELA GRADUADA ESTADO TRUJILLO,885,2,15,676,382,661,1,7,0,1,270,676
EDO. MIRANDA,MP. BRION,PQ. CURIEPE,ESCUELA CONCENTRACION SIN NUMERO,247,1,7,187,135,180,0,0,0,0,45,187
EDO. MIRANDA,MP. BRION,PQ. CURIEPE,PRE ESCOLAR JARDIN DE INFANCIA SIXTO DOMINGO LOPEZ,1934,4,50,1619,1120,1569,0,10,2,1,436,1619
EDO. MIRANDA,MP. BRION,PQ. CURIEPE,LICEO NACIONAL PEDRO MARIA JOSE,1436,3,20,1130,918,1110,0,3,0,0,189,1130
EDO. MIRANDA,MP. BRION,PQ. CURIEPE,ESCUELA BASICA MORON,681,2,16,552,419,536,0,1,0,0,116,552
EDO. MIRANDA,MP. BRION,PQ. CURIEPE,ESCUELA ESTADAL BOLIVARIANA TACARIGUITA,641,2,15,503,318,488,1,0,1,0,168,503
EDO. MIRANDA,MP. BRION,PQ. TACARIGUA,UNIDAD EDUCATIVA GAMELOTAL,1064,2,28,857,561,829,0,7,0,2,259,857
EDO. MIRANDA,MP. BRION,PQ. TACARIGUA,ESCUELA BOLIVARIANA LA FUNDACIÓN,614,2,20,490,299,470,0,1,0,1,169,490
EDO. MIRANDA,MP. BRION,PQ. TACARIGUA,CENTRO TECNOLOGICO LA ARBOLEDA,339,1,19,301,212,282,0,1,0,0,69,301
EDO. MIRANDA,MP. BRION,PQ. TACARIGUA,ESCUELA BOLIVARIANA ESTILITO DIAZ APONTE,661,2,18,542,331,524,0,5,0,0,188,542
EDO. MIRANDA,MP. BRION,PQ. TACARIGUA,BIBLIOTECA LAS CORALIAS,357,1,5,313,253,308,0,1,0,0,54,313
EDO. MIRANDA,MP. BRION,PQ. TACARIGUA,ESCUELA BOLIVARIANA LAS GONZÁLEZ,648,2,25,545,303,520,0,4,0,0,213,545
EDO. MIRANDA,MP. BRION,PQ. TACARIGUA,ESCUELA BOLIVARIANA LAS MARTINEZ,1019,2,22,844,543,822,0,3,0,0,276,844
EDO. MIRANDA,MP. BRION,PQ. TACARIGUA,UNIDAD EDUCATIVA ESTADAL MATURIN,567,1,5,500,397,495,0,2,1,0,95,500
EDO. MIRANDA,MP. BRION,PQ. TACARIGUA,UNIDAD EDUCATIVA BARLOVENTO,4158,8,46,3276,1784,3230,0,18,1,5,1422,3276
EDO. MIRANDA,MP. URDANETA,PQ. NUEVA CUA,UNIDAD EDUCATIVA NACIONAL EXTENSION RAFAEL RAFAEL RANGEL,483,1,7,419,336,412,0,3,0,0,73,419
EDO. MIRANDA,MP. URDANETA,PQ. NUEVA CUA,CONCENTRACION ESCOLAR ESTADAL SIN NUMERO ANIAGUA NUCLEO ESCOLAR RURAL 127,404,1,8,274,217,266,0,2,0,0,47,274
EDO. MIRANDA,MP. URDANETA,PQ. NUEVA CUA,ESCUELA BASICA ESTADAL NUEVA CUA,342,1,5,277,236,272,0,1,0,0,35,277
EDO. MIRANDA,MP. URDANETA,PQ. NUEVA CUA,ESCUELA BASICA CREACION CUA,3967,7,71,3382,2390,3311,3,18,0,3,897,3382
EDO. MIRANDA,MP. URDANETA,PQ. NUEVA CUA,UNIDAD EDUCATIVA RURAL BOLIVARIANA QUEBRADA HONDA,1169,2,36,884,665,848,0,6,1,0,176,884
EDO. MIRANDA,MP. URDANETA,PQ. NUEVA CUA,CONCENTRACION ESTADAL SIN NUMERO LOS ROSOS,654,2,9,497,370,488,0,1,1,0,116,497
EDO. MIRANDA,MP. URDANETA,PQ. NUEVA CUA,ESCUELA BASICA NACIONAL NUEVA CUA,3069,6,76,2507,1883,2431,1,10,1,2,534,2507
EDO. MIRANDA,MP. URDANETA,PQ. NUEVA CUA,ESCUELA BASICA ESTADAL BOLIVARIANA LA PROVIDENCIA,589,1,15,422,346,407,0,4,1,0,56,422
EDO. MIRANDA,MP. URDANETA,PQ. NUEVA CUA,ESCUELA BASICA BOLIVARIANA JOSE LEONARDO CHIRINOS,2206,4,35,1855,1366,1820,0,7,0,0,447,1855
EDO. MIRANDA,MP. URDANETA,PQ. NUEVA CUA,CASA DE LA CULTURA,971,2,13,792,605,779,1,6,2,1,164,792
EDO. MIRANDA,MP. URDANETA,PQ. NUEVA CUA,SIMONCITO COMUNITARIO SIMON BOLIVAR,108,1,3,78,63,75,0,0,0,0,12,78
EDO. MIRANDA,MP. URDANETA,PQ. NUEVA CUA,CONCENTRACION ESCOLAR ESTADAL SIN NUMERO LA PALMA,68,1,4,63,58,59,0,0,0,0,1,63
EDO. MIRANDA,MP. URDANETA,PQ. NUEVA CUA,CONCENTRACION ESTADAL SUTIL,142,1,5,128,105,123,0,0,0,0,18,128
EDO. MIRANDA,MP. URDANETA,PQ. NUEVA CUA,UNIDAD EDUCATIVA ESTADAL ANDRES BELLO,1614,3,38,1372,978,1334,2,6,2,3,343,1372
EDO. MIRANDA,MP. URDANETA,PQ. NUEVA CUA,UNIDAD EDUCATIVA ESTADAL LA GUADALUPE,807,2,16,668,517,652,0,3,1,0,131,668
EDO. MIRANDA,MP. URDANETA,PQ. NUEVA CUA,UNIDAD EDUCATIVA ESTADAL BOLIVARIANA SAN JUAN BAUTISTA,371,1,9,328,263,319,0,3,1,0,52,328
EDO. MIRANDA,MP. URDANETA,PQ. NUEVA CUA,UNIDAD EDUCATIVA ESTADAL JOSE GIL FORTOUL,1111,2,17,911,723,894,1,2,1,0,167,911
EDO. MIRANDA,MP. URDANETA,PQ. NUEVA CUA,CONCENTRACION ESCOLAR NUMERO 110 CAMPO VERDE,211,1,3,173,137,170,1,2,0,0,30,173
EDO. MIRANDA,MP. URDANETA,PQ. NUEVA CUA,CONCENTRACION ESCOLAR ESTADAL SIN NUMERO PALMIRA,167,1,0,129,78,129,0,2,0,0,49,129
EDO. MIRANDA,MP. URDANETA,PQ. NUEVA CUA,CONCENTRACION ESCOLAR ESTADAL BOLIVARIANA LOS CHAGUARAMOS,242,1,10,215,169,205,0,1,0,0,35,215
EDO. MIRANDA,MP. URDANETA,PQ. NUEVA CUA,ESCUELA NACIONAL BOLIVARIANA MANUELITA SAENZ,1237,3,23,915,698,892,1,4,1,1,187,915
EDO. MIRANDA,MP. URDANETA,PQ. NUEVA CUA,CONCENTRACION ESCOLAR SIN NUMERO AGUA AMARILLA DEL NER 27,274,1,4,211,175,207,0,3,0,0,29,211
EDO. MIRANDA,MP. URDANETA,PQ. NUEVA CUA,UNIDAD EDUCATIVA NACIONAL RAFAEL RANGEL,2520,5,54,1995,1479,1941,1,4,1,0,456,1995
EDO. MIRANDA,MP. URDANETA,PQ. NUEVA CUA,UNIDAD EDUCATIVA NACIONAL 12  DE OCTUBRE,352,1,9,258,215,249,0,0,0,0,34,258
EDO. MIRANDA,MP. URDANETA,PQ. NUEVA CUA,UNIVERSIDAD SISO MARTINEZ,2596,5,32,2147,1638,2115,3,14,0,2,458,2147
EDO. MIRANDA,MP. URDANETA,PQ. CUA,UNIDAD EDUCATIVA NACIONAL BOLIVARINA EZEQUIEL ZAMORA,3748,7,61,3107,2115,3046,1,21,2,4,903,3107
EDO. MIRANDA,MP. URDANETA,PQ. CUA,CENTRO DE EDUCACION INICIAL FELIPA TORO,383,1,6,337,223,331,0,1,2,0,105,337
EDO. MIRANDA,MP. URDANETA,PQ. CUA,ESCUELA BASICA NACIONAL CRISTOBAL ROJAS,3630,7,66,2976,1605,2910,0,5,3,1,1296,2976
EDO. MIRANDA,MP. URDANETA,PQ. CUA,UNIDAD ESTADAL MINISTERIO DE AGRICULTURA Y TIERRA,609,2,5,531,280,526,0,1,1,2,242,531
EDO. MIRANDA,MP. URDANETA,PQ. CUA,CONCENTRACION ESCOLAR ESTADAL SIN NUMERO SACUA,222,1,7,129,105,122,0,0,0,0,17,129
EDO. MIRANDA,MP. URDANETA,PQ. CUA,ESCUELA NACIONAL LESBIA PLATERS,3940,7,77,3316,2032,3239,2,23,3,2,1177,3316
EDO. MIRANDA,MP. URDANETA,PQ. CUA,UNIDAD EDUCATIVA NACIONAL VICENTE LECUNA,568,1,6,506,403,500,0,0,0,1,96,506
EDO. MIRANDA,MP. URDANETA,PQ. CUA,UNIDAD EDUCATIVA NACIONAL BOLIVARIANA LIBERTADOR SIMON BOLIVAR,1986,4,22,1630,1115,1608,1,7,1,1,483,1630
EDO. MIRANDA,MP. URDANETA,PQ. CUA,ESCUELA ESTADAL CONSUELO HERNANDEZ,4761,9,127,3852,2312,3725,1,15,2,2,1393,3852
EDO. MIRANDA,MP. URDANETA,PQ. CUA,ESCUELA BASICA ESTADAL CREACION BICENTENARIA,1693,3,46,1408,1199,1362,1,3,0,1,158,1408
EDO. MIRANDA,MP. URDANETA,PQ. CUA,UNIDAD EDUCATIVA NACIONAL RAFAEL URDANETA EXTENCION ATENEO,3253,6,64,2719,1264,2655,1,18,3,6,1363,2719
EDO. MIRANDA,MP. URDANETA,PQ. CUA,ESCUELA BASICA ESTADAL  JOSE MARIA CARRE O,2732,5,46,2213,1624,2167,1,9,0,0,533,2213
EDO. MIRANDA,MP. URDANETA,PQ. CUA,PREESCOLAR NACIONAL CRISTOBAL ROJAS,1150,2,22,950,499,928,0,3,0,0,426,950
EDO. MIRANDA,MP. URDANETA,PQ. CUA,CONCENTRACION ESCOLAR SIN NUMERO MUME ABAJO,268,1,2,231,211,229,0,2,0,0,16,231
EDO. MIRANDA,MP. URDANETA,PQ. CUA,UNIDAD EDUCATIVA NACIONAL RAFAEL URDANETA,1460,3,16,1362,596,1346,1,4,0,2,743,1362
EDO. MIRANDA,MP. URDANETA,PQ. CUA,UNIDAD EDUCATIVA ESTADAL CONSUELO PORTILLO,936,2,18,760,565,742,0,4,1,0,172,760
EDO. MIRANDA,MP. URDANETA,PQ. CUA,CONCENTRACION ESCOLAR RURAL NUMERO 17,2102,4,31,1659,1177,1628,1,5,1,0,444,1659
EDO. MIRANDA,MP. URDANETA,PQ. CUA,UNIDAD EDUCATIVA ESTADAL GENERAL RAFAEL URDANETA,2417,5,42,2222,851,2180,2,3,0,3,1321,2222
EDO. MIRANDA,MP. URDANETA,PQ. CUA,UNIDAD ESCOLAR NACIONAL DISTRITO CAPITAL,2213,4,82,1858,1472,1776,0,9,1,1,293,1858
EDO. MIRANDA,MP. URDANETA,PQ. CUA,CENTRO INFANTIL EDUCATIVO EULALIA BUROZ,2467,5,51,1985,976,1934,0,7,0,4,947,1985
EDO. MIRANDA,MP. URDANETA,PQ. CUA,UNIDAD EDUCATIVA NACIONAL JOSE DE SAN MARTIN,4641,9,65,3857,2385,3792,1,19,2,3,1382,3857
EDO. MIRANDA,MP. URDANETA,PQ. CUA,ESCUELA TECNICA INDUSTRIAL CRUZ VILLEGAS,1916,4,60,1723,1016,1663,0,8,1,2,636,1723
EDO. MIRANDA,MP. URDANETA,PQ. CUA,CASA DE LA CULTURA PANCHO PRIN,957,2,21,850,385,829,0,5,1,1,437,850
EDO. MIRANDA,MP. URDANETA,PQ. CUA,COMEDOR MUNICIPAL PAULA CORREA,1269,3,29,1120,756,1091,1,5,0,1,328,1120
EDO. MIRANDA,MP. URDANETA,PQ. CUA,CICLO BASICO CUA,3200,6,66,2892,1270,2826,0,8,3,6,1539,2892
EDO. MIRANDA,MP. URDANETA,PQ. CUA,PLAZA BOLIVAR DE CUA,115,1,5,88,52,83,0,1,0,0,30,88
EDO. MIRANDA,MP. URDANETA,PQ. CUA,ESCUELA BOLIVARIANA CONCENTRACION ESCOLAR RURAL LAS CASITAS,51,1,1,47,37,46,0,0,0,0,9,47
EDO. MIRANDA,MP. URDANETA,PQ. CUA,UNIDAD EDUCATIVA NACIONAL EZEQUIEL ZAMORA,2529,5,50,2090,1303,2040,0,12,1,6,718,2090
EDO. MIRANDA,MP. URDANETA,PQ. CUA,ESCUELA BASICA ESTADAL PROFESOR JESUS MARIA RANGEL,365,1,7,334,273,327,0,0,0,0,54,334
EDO. MIRANDA,MP. LANDER,PQ. LA DEMOCRACIA,CONCENTRACION ESCOLAR LOS CONFINES N.E.R 011,294,1,6,189,155,183,0,0,0,0,28,189
EDO. MIRANDA,MP. LANDER,PQ. LA DEMOCRACIA,CONCENTRACION ESCOLAR NUMERO 69 QUIRIPITAL,429,1,10,282,204,272,0,0,0,0,68,282
EDO. MIRANDA,MP. LANDER,PQ. LA DEMOCRACIA,ESCUELA BOLIVARIANA ESTADAL SAN VICENTE,195,1,1,176,137,175,0,0,0,0,38,176
EDO. MIRANDA,MP. LANDER,PQ. LA DEMOCRACIA,CONCENTRACION ESCOLAR SIN NUMERO GUAYAMURAL,367,1,3,272,210,269,0,2,0,0,57,272
EDO. MIRANDA,MP. LANDER,PQ. SANTA BARBARA,UNIDAD EDUCATIVA NACIONAL LILIA DE PIÑERO,3681,7,62,2986,2142,2924,0,12,1,2,767,2986
EDO. MIRANDA,MP. LANDER,PQ. SANTA BARBARA,UNIDAD EDUCATIVA ESTADAL  MATA PRINERA,541,1,6,483,413,477,0,1,0,0,63,483
EDO. MIRANDA,MP. LANDER,PQ. SANTA BARBARA,UNIDAD EDUCATIVA NACIONAL JUANA RAMIREZ,2108,4,42,1910,1806,1868,2,1,2,1,56,1910
EDO. MIRANDA,MP. LANDER,PQ. SANTA BARBARA,UNIDAD EDUCATIVA TECNICA AGROPECUARIA PIÑATE,1537,3,44,1290,870,1246,0,4,2,2,368,1290
EDO. MIRANDA,MP. LANDER,PQ. OCUMARE DEL TUY,UNIDAD EDUCATIVA NACIONAL BOLIVARIANA BATALLA DE CARABOBO,612,2,6,453,411,447,1,0,1,1,33,453
EDO. MIRANDA,MP. LANDER,PQ. OCUMARE DEL TUY,ESCUELA BASICA  SAN BASILIO,146,1,1,121,109,120,0,0,0,0,11,121
EDO. MIRANDA,MP. LANDER,PQ. OCUMARE DEL TUY,CENTRO DE EDUCACION INICIAL VALLECITO,706,2,9,629,523,620,1,2,0,0,94,629
EDO. MIRANDA,MP. LANDER,PQ. OCUMARE DEL TUY,UNIDAD EDUCATIVA ESTADAL ESTADO TACHIRA,2849,5,27,2186,1663,2159,2,13,0,1,480,2186
EDO. MIRANDA,MP. LANDER,PQ. OCUMARE DEL TUY,ESCUELA BASICA ESTADAL DOCTOR JOSE MARIA VARGAS,903,2,8,781,699,773,0,1,0,0,73,781
EDO. MIRANDA,MP. LANDER,PQ. OCUMARE DEL TUY,UNIDAD EDUCATIVA ESTADAL PABLO CALZADILLA,404,1,4,332,279,328,0,1,1,0,47,332
EDO. MIRANDA,MP. LANDER,PQ. OCUMARE DEL TUY,CENTRO DE EDUCACION INICIAL BOLIVARIANO SENDERO DE LUZ,481,1,7,420,361,413,1,1,0,0,50,420
EDO. MIRANDA,MP. LANDER,PQ. OCUMARE DEL TUY,CONCENTRACION ESCOLAR CAICITA,625,2,8,444,374,436,0,3,0,0,59,444
EDO. MIRANDA,MP. LANDER,PQ. OCUMARE DEL TUY,UNIDAD EDUCATIVA NACIONAL MANUEL DE ALESON,939,2,14,736,421,722,0,5,1,0,295,736
EDO. MIRANDA,MP. LANDER,PQ. OCUMARE DEL TUY,CENTRO DE EDUCACION INICIAL  MATA DE COCO,762,2,14,681,595,667,0,7,2,0,63,681
EDO. MIRANDA,MP. LANDER,PQ. OCUMARE DEL TUY,UNIDAD EDUCATIVA ESTADAL JOSE FELIX RIBAS,2539,5,28,2054,1767,2026,0,12,3,0,244,2054
EDO. MIRANDA,MP. LANDER,PQ. OCUMARE DEL TUY,INSTITUTO UNIVERSITARIO TOMAS LANDER,1302,3,17,1177,467,1160,0,1,0,0,692,1177
EDO. MIRANDA,MP. LANDER,PQ. OCUMARE DEL TUY,UNIDAD EDUCATIVA COLEGIO TOMAS LANDER,1655,3,37,1349,657,1312,1,7,0,1,646,1349
EDO. MIRANDA,MP. LANDER,PQ. OCUMARE DEL TUY,UNIDAD EDUCATIVA ESTADAL ANA MARIA DE DELGADO,1600,3,26,1455,795,1429,0,7,0,3,624,1455
EDO. MIRANDA,MP. LANDER,PQ. OCUMARE DEL TUY,CENTRO DE EDUCACION INICIAL  MARIA SOSA DE BELVIS,2247,4,28,1915,1608,1887,1,6,0,0,272,1915
EDO. MIRANDA,MP. LANDER,PQ. OCUMARE DEL TUY,ESCUELA BASICA ESTADAL MERCEDEZ DE PEREZ,3153,6,51,2608,1930,2557,1,20,0,2,604,2608
EDO. MIRANDA,MP. LANDER,PQ. OCUMARE DEL TUY,COMPLEJO EDUCATIVO NACIONAL ALBERTO SMITH,5667,10,123,4662,3080,4539,0,27,5,3,1424,4662
EDO. MIRANDA,MP. LANDER,PQ. OCUMARE DEL TUY,CENTRO DE EDUCACION INICIAL NACIONAL 13 DE MARZO DE 1814,507,1,10,454,411,444,0,0,0,0,33,454
EDO. MIRANDA,MP. LANDER,PQ. OCUMARE DEL TUY,UNIDAD EDUCATIVA ESTADAL ARAGUITA I,2151,4,54,1839,1130,1785,0,6,0,0,649,1839
EDO. MIRANDA,MP. LANDER,PQ. OCUMARE DEL TUY,CASA DE LA CULTURA JOSE FELIX RIBAS,2117,4,31,1769,1041,1738,0,5,0,0,692,1769
EDO. MIRANDA,MP. LANDER,PQ. OCUMARE DEL TUY,CENTRO DE FORMACION DE RECURSOS HUMANOS SAN JUAN BAUTISTA DE LA SALLE,388,1,11,361,238,350,0,0,0,0,112,361
EDO. MIRANDA,MP. LANDER,PQ. OCUMARE DEL TUY,UNIDAD EDUCATIVA ESTADAL MONSEÑOR RAFAEL PEREZ LEON,3141,6,61,2554,1867,2493,0,14,1,3,608,2554
EDO. MIRANDA,MP. LANDER,PQ. OCUMARE DEL TUY,CONCENTRACION EDUCATIVO VALLES DEL TUY,3084,6,66,2438,1794,2372,2,10,4,2,560,2438
EDO. MIRANDA,MP. LANDER,PQ. OCUMARE DEL TUY,COMPLEJO EDUCATIVO NACIONAL MERCEDES RASCO,5704,10,100,4665,3834,4565,2,14,3,5,707,4665
EDO. MIRANDA,MP. LANDER,PQ. OCUMARE DEL TUY,UNIDAD EDUCATIVA ESTADAL BOLIVARIANA LA UVERITA,335,1,15,300,269,285,0,0,0,0,16,300
EDO. MIRANDA,MP. LANDER,PQ. OCUMARE DEL TUY,GRUPO ESCOLAR DOCTOR  OBDULIO ALVAREZ,2749,5,41,2245,1456,2204,0,7,0,3,738,2245
EDO. MIRANDA,MP. LANDER,PQ. OCUMARE DEL TUY,IPASME OCUMARE DEL TUY,1724,3,50,1411,980,1361,0,9,0,2,370,1411
EDO. MIRANDA,MP. LANDER,PQ. OCUMARE DEL TUY,CONCETRACION ESCOLAR QUEBRADA DE MIGUEL,180,1,0,116,110,116,0,0,0,1,5,116
EDO. MIRANDA,MP. LANDER,PQ. OCUMARE DEL TUY,ESCUELA BASICA ESTADAL CHAMICERO,2230,4,56,1824,1298,1768,1,10,3,1,455,1824
EDO. MIRANDA,MP. LANDER,PQ. OCUMARE DEL TUY,CENTRO DE EDUCACION INICIAL VIRGEN DE BETANIA,1174,2,12,1019,939,1007,1,4,0,0,63,1019
EDO. MIRANDA,MP. LANDER,PQ. OCUMARE DEL TUY,UNIDAD EDUCATIVA ESTADAL ANTONIO JOSE DE SUCRE,2193,4,38,1763,1419,1725,0,14,1,0,291,1763
EDO. MIRANDA,MP. LANDER,PQ. OCUMARE DEL TUY,ESCUELA BASICA NACIONAL ARAGUITA,3526,7,72,2836,2020,2764,0,12,1,3,728,2836
EDO. MIRANDA,MP. LANDER,PQ. OCUMARE DEL TUY,UNIDAD EDUCATIVA NACIONAL EXTENSION ROSA PENA,548,1,10,475,410,465,0,2,0,0,53,475
EDO. MIRANDA,MP. LANDER,PQ. OCUMARE DEL TUY,UNIDAD EDUCATIVA ESTADAL PILONCITO,1039,2,32,893,679,861,0,3,2,1,176,893
EDO. MIRANDA,MP. LANDER,PQ. OCUMARE DEL TUY,ESCUELA PRIMARIA BOLIVARIANA MIRANDA,2931,6,52,2370,1359,2318,0,8,0,2,949,2370
EDO. MIRANDA,MP. LANDER,PQ. OCUMARE DEL TUY,UNIDAD EDUCATIVA NACIONAL  JUAN ANTONIO PEREZ BONALDE,2635,5,63,2207,1281,2144,1,14,4,2,842,2207
EDO. MIRANDA,MP. LANDER,PQ. OCUMARE DEL TUY,UNIDAD EDUCATIVA FE Y ALEGRIA PAMPERO,3599,7,61,2974,2196,2913,1,8,2,3,703,2974
EDO. MIRANDA,MP. LANDER,PQ. OCUMARE DEL TUY,UNIDAD EDUCATIVA ESTADAL EVA DE TERAN,2578,5,73,2033,1372,1960,0,15,1,1,571,2033
EDO. MIRANDA,MP. LANDER,PQ. OCUMARE DEL TUY,UNIDAD EDUCATIVA NACIONAL OCUMARE,1407,3,43,1081,744,1038,0,5,1,0,288,1081
EDO. MIRANDA,MP. LANDER,PQ. OCUMARE DEL TUY,CASA COMUNAL LA VERANIEGA,245,1,3,222,207,219,0,1,0,0,11,222
EDO. MIRANDA,MP. LANDER,PQ. OCUMARE DEL TUY,ESCUELA BASICA ESTADAL TERRITORIO FEDERAL  AMAZONAS,2210,4,27,1793,1536,1766,2,9,0,3,216,1793
EDO. MIRANDA,MP. LANDER,PQ. OCUMARE DEL TUY,UNIDAD EDUCATIVA NACIONAL BOLIVARIANA DOCTOR LUIS RAZETTI,844,2,24,688,548,664,0,3,0,1,112,688
EDO. MIRANDA,MP. LANDER,PQ. OCUMARE DEL TUY,UNIDAD EDUCATIVA ESTADAL GRAN MARISCAL DE AYACUCHO,309,1,10,297,262,287,0,2,0,0,23,297
EDO. MIRANDA,MP. LANDER,PQ. OCUMARE DEL TUY,UNIDAD EDUCATIVA NACIONAL  ROSA PEÑA,3475,6,46,2888,1889,2842,0,21,2,0,930,2888
EDO. MIRANDA,MP. ACEVEDO,PQ. AREVALO GONZALEZ,CONCENTRACION NACIONAL NUMERO 1827 LA CONCEPCION,278,1,7,220,159,213,0,0,0,0,54,220
EDO. MIRANDA,MP. ACEVEDO,PQ. AREVALO GONZALEZ,ESCUELA UNITARIA NACIONAL NUMERO 1734 LAS BRISAS DE BURGUILLOS,295,1,3,185,125,182,0,0,0,0,57,185
EDO. MIRANDA,MP. ACEVEDO,PQ. AREVALO GONZALEZ,CONCENTRACION NACIONAL NUMERO 77 MARCELO,569,1,8,426,353,418,0,2,0,0,63,426
EDO. MIRANDA,MP. ACEVEDO,PQ. AREVALO GONZALEZ,ESCUELA  BOLIVARIANA. NACIONAL  VALLE DE URAPE (NUCLEO ENDOGENO RURAL  096),81,1,4,67,29,63,0,1,0,0,33,67
EDO. MIRANDA,MP. ACEVEDO,PQ. AREVALO GONZALEZ,ESCUELA BOLIVARIANA ESTADAL CONCENTRACION CAÑO NEGRO (NUCLEO ENDOGENO RURAL 010),100,1,2,89,79,87,0,1,0,0,7,89
EDO. MIRANDA,MP. ACEVEDO,PQ. AREVALO GONZALEZ,UNIDAD EDUCATIVA BOLIVARIANA PEDRO JOSE RODRIGUEZ,1365,3,28,1050,735,1022,0,4,0,0,283,1050
EDO. MIRANDA,MP. ACEVEDO,PQ. AREVALO GONZALEZ,UNIDAD EDUCATIVA CREACION EL CLAVO,213,1,3,140,112,137,0,0,0,0,25,140
EDO. MIRANDA,MP. ACEVEDO,PQ. AREVALO GONZALEZ,ESCUELA GRADUADA MERECURE REMOLINO,732,2,21,569,466,548,1,3,2,0,76,569
EDO. MIRANDA,MP. ACEVEDO,PQ. AREVALO GONZALEZ,CONCENTRACION  ESTADAL SIN NUMERO POTRERO RUBINO,155,1,4,114,53,110,0,0,2,0,55,114
EDO. MIRANDA,MP. ACEVEDO,PQ. AREVALO GONZALEZ,UNIDAD EDUCATIVA CABANO CARPIO,405,1,9,295,200,286,0,2,0,0,84,295
EDO. MIRANDA,MP. ACEVEDO,PQ. PANAQUIRE,CONCENTRACION ESTATAL NUMERO  23,213,1,1,143,92,142,1,2,0,0,47,143
EDO. MIRANDA,MP. ACEVEDO,PQ. PANAQUIRE,ESCUELA UNITARIA NACIONAL NUMERO  575,281,1,7,246,181,239,0,1,0,0,57,246
EDO. MIRANDA,MP. ACEVEDO,PQ. PANAQUIRE,UNIDAD EDUCATIVA NACIONAL BOLIVARIANA JOSE MARIA VARGAS,548,1,11,453,395,442,0,0,0,0,47,453
EDO. MIRANDA,MP. ACEVEDO,PQ. PANAQUIRE,UNIDAD EDUCATIVA LICEO BOLIVARIANO PANAQUIRE,298,1,1,245,204,244,0,2,0,0,38,245
EDO. MIRANDA,MP. ACEVEDO,PQ. PANAQUIRE,ESCUELA BASICA ESTADAL  CONCENTRADA EL SAPO BAMBU NUCLEO ESTUDIANTIL  RURAL 010,86,1,0,77,72,77,0,0,0,0,5,77
EDO. MIRANDA,MP. ACEVEDO,PQ. PANAQUIRE,CONCENTRACION ESTADAL NUMERO 3,169,1,1,114,95,113,0,0,0,0,18,114
EDO. MIRANDA,MP. ACEVEDO,PQ. PANAQUIRE,ESCUELA BASICA CREACION LA BALZA,557,1,20,447,333,427,0,1,0,0,93,447
EDO. MIRANDA,MP. ACEVEDO,PQ. PANAQUIRE,GRUPO ESCOLAR NACIONAL JOSE NICOMEDES MARRERO,2016,4,62,1551,849,1489,0,6,2,0,632,1551
EDO. MIRANDA,MP. ACEVEDO,PQ. PANAQUIRE,ESCUELA BASICA ESTADAL CONCENTRACION URBA NUCLEO ESCOLAR RURAL 010,118,1,2,100,81,98,0,0,0,0,17,100
EDO. MIRANDA,MP. ACEVEDO,PQ. PANAQUIRE,CONCENTRACION ESTADAL BOLIVARIANA MANGO DE OCOITA,343,1,4,274,247,270,0,1,1,0,21,274
EDO. MIRANDA,MP. ACEVEDO,PQ. PANAQUIRE,CONCENTRACION ESTATAL NUMERO 16,198,1,3,134,100,131,0,0,0,1,30,134
EDO. MIRANDA,MP. ACEVEDO,PQ. ARAGUITA,CONCENTRACION ESTADAL SIN NUMERO CUPATA,355,1,11,277,241,266,0,0,0,0,25,277
EDO. MIRANDA,MP. ACEVEDO,PQ. ARAGUITA,UNIDAD EDUCATIVA LA FILA,782,2,23,609,497,586,0,1,1,0,87,609
EDO. MIRANDA,MP. ACEVEDO,PQ. ARAGUITA,ESCUELA BASICA CONCENTRACION EL SOCORRO EL PEINE,150,1,7,133,105,126,0,2,0,0,19,133
EDO. MIRANDA,MP. ACEVEDO,PQ. ARAGUITA,UNIDAD EDUCATIVA JULIAN OJEDA,2051,4,34,1537,1045,1503,0,7,1,0,450,1537
EDO. MIRANDA,MP. ACEVEDO,PQ. ARAGUITA,ESCUELA BASICA ESTADAL CONCENTRACION EL LATON NUCLEO ENDOGENO RURAL 09,251,1,3,211,162,208,0,1,0,0,45,211
EDO. MIRANDA,MP. ACEVEDO,PQ. ARAGUITA,CONCENTRACION ESTATAL NUMERO 26 EL PEÑON,709,2,2,516,384,514,0,1,0,0,129,516
EDO. MIRANDA,MP. ACEVEDO,PQ. ARAGUITA,CONCENTRACION ESTADAL NUMERO 18 EL SOCORRO,598,1,10,405,307,395,1,1,1,0,85,405
EDO. MIRANDA,MP. ACEVEDO,PQ. MARIZAPA,ESCUELA ESTADAL GRADUADA DOCTOR ARNALDO AROCHA VARGAS,3511,6,150,2834,1762,2684,0,15,1,1,905,2834
EDO. MIRANDA,MP. ACEVEDO,PQ. MARIZAPA,CONCENTRACION ESTADAL SIN LOS COCOS,614,2,14,527,466,513,0,4,1,0,42,527
EDO. MIRANDA,MP. ACEVEDO,PQ. MARIZAPA,UNIDAD EDUCATIVA ARGELIA LAYA,732,2,24,601,395,577,1,1,0,1,179,601
EDO. MIRANDA,MP. ACEVEDO,PQ. MARIZAPA,ESCUELA BASICA ESTADAL CONCENTRADA  SIN NUMERO CUPO,792,2,11,674,557,663,0,2,0,0,104,674
EDO. MIRANDA,MP. ACEVEDO,PQ. CAUCAGUA,COLEGIO LA ENCARNACION,2110,4,35,1725,697,1690,1,11,1,0,980,1725
EDO. MIRANDA,MP. ACEVEDO,PQ. CAUCAGUA,ESCUELA BOLIVARIANA LA COTARA,966,2,13,837,664,824,0,9,1,2,148,837
EDO. MIRANDA,MP. ACEVEDO,PQ. CAUCAGUA,ESCUELA NACIONAL JOSE MARIA CARREÑO MENDOZA,495,1,11,403,303,392,0,2,0,0,87,403
EDO. MIRANDA,MP. ACEVEDO,PQ. CAUCAGUA,ESCUELA  BOLIVARIANA NACIONAL EL MARQUEZ,489,1,8,416,260,408,0,2,1,1,144,416
EDO. MIRANDA,MP. ACEVEDO,PQ. CAUCAGUA,CONCENTRACION ESTATAL NUMERO 25,1153,2,13,824,591,811,1,7,1,0,211,824
EDO. MIRANDA,MP. ACEVEDO,PQ. CAUCAGUA,UNIDAD EDUCATIVA ROSCIO,4792,9,105,3528,1786,3423,1,23,5,2,1606,3528
EDO. MIRANDA,MP. ACEVEDO,PQ. CAUCAGUA,ESCUELA BASICA ESTADAL CONCENTRADA LA CALIFORNIA NUCLEO ESCOLAR RURAL 011,169,1,8,138,104,130,0,1,0,0,25,138
EDO. MIRANDA,MP. ACEVEDO,PQ. CAUCAGUA,CONCENTRACION ESTATAL NUMERO 27 LOS CERRITOS,845,2,27,614,416,587,1,6,0,4,160,614
EDO. MIRANDA,MP. ACEVEDO,PQ. CAUCAGUA,CONCENTRACION ESTADAL NUMERO 4 CHUSPITA,1191,3,14,911,572,897,0,3,0,0,322,911
EDO. MIRANDA,MP. ACEVEDO,PQ. CAUCAGUA,ESCUELA BASICA ESTADAL CONCENTRADA LA BOCA NUCLEO ESCOLAR RURAL  013,232,1,4,206,193,202,0,0,0,0,9,206
EDO. MIRANDA,MP. ACEVEDO,PQ. CAUCAGUA,CONCENTRADA ESTADAL SIN NUMERO AGUA FRIA,436,1,12,303,249,291,0,2,0,0,40,303
EDO. MIRANDA,MP. ACEVEDO,PQ. CAUCAGUA,ESCUELA BASICA ESCOLAR  CONCENTRADA  SAN RAFAEL  NUCLEO ESCOLAR RURAL  011,261,1,5,235,201,230,0,1,1,0,27,235
EDO. MIRANDA,MP. ACEVEDO,PQ. CAUCAGUA,ESCUELA UNITARIA ESTADAL NUMERO 11,1043,2,30,828,578,798,0,4,0,0,216,828
EDO. MIRANDA,MP. ACEVEDO,PQ. CAUCAGUA,ESCUELA ESTADAL UNITARIA NUMERO 2316 MERCURE CENTRO,461,1,11,346,282,335,2,0,1,0,50,346
EDO. MIRANDA,MP. ACEVEDO,PQ. CAUCAGUA,UNIDAD EDUCATIVA RICARDA TOVAR,1039,2,16,836,704,820,0,2,0,0,114,836
EDO. MIRANDA,MP. ACEVEDO,PQ. CAUCAGUA,UNIDAD EDUCATIVA ALTAGRACIA,978,2,21,739,568,718,0,7,1,0,142,739
EDO. MIRANDA,MP. ACEVEDO,PQ. CAUCAGUA,UNIDAD EDUCATIVA MARIA ENRIQUETA SARRATUD,323,1,5,246,140,241,0,0,0,0,101,246
EDO. MIRANDA,MP. ACEVEDO,PQ. CAUCAGUA,UNIDAD EDUCATIVA BOLIVARIANA PANTOJA,1600,3,34,1261,753,1227,0,2,0,4,468,1261
EDO. MIRANDA,MP. ACEVEDO,PQ. CAUCAGUA,UNIDAD EDUCATIVA CAUCAGUA,466,1,9,334,211,325,0,0,0,1,113,334
