Estado,Municipio,Parroquia,Centro,Número de Electores escrutados.,Número de Actas Procesadas.,Número total de Votos Nulos.,Número Total de Votantes que votaron realmente.,HUGO CHAVEZ,Número total de Votos Válidos.,ORLANDO CHIRINO,REINA SEQUERA,LUIS REYES,MARIA BOLIVAR,HENRIQUE CAPRILES RADONSKI,Número de Votos Escrutados.
EDO. MERIDA,CE. LIBERTADOR,PQ. ARIAS,UNIDAD EDUCATIVA TULIO FEBRES CORDERO,3007,6,41,2499,740,2458,0,12,0,1,1705,2499
EDO. MERIDA,CE. LIBERTADOR,PQ. ARIAS,COLEGIO NUESTRA SEÑORA DE BELEN,1400,3,29,1192,387,1163,0,5,0,0,771,1192
EDO. MERIDA,CE. LIBERTADOR,PQ. ARIAS,COLEGIO PRIVADO JARDIN FRANCISCANO,2954,6,81,2483,1205,2402,1,12,2,2,1180,2483
EDO. MERIDA,CE. LIBERTADOR,PQ. ARIAS,LICEO TULIO FEBRES CORDERO (B),480,1,8,413,158,405,1,5,0,2,239,413
EDO. MERIDA,CE. LIBERTADOR,PQ. ARIAS,ESCUELA BASICA NACIONAL RIVAS DAVILA,1102,2,8,911,335,903,1,0,0,0,567,911
EDO. MERIDA,CE. LIBERTADOR,PQ. ARIAS,UNIDAD EDUCATIVA EZEQUIEL ZAMORA,689,2,9,612,316,603,0,1,0,2,284,612
EDO. MERIDA,CE. LIBERTADOR,PQ. ARIAS,UNIDAD EDUCATIVA LA PUEBLITA,559,1,6,484,262,478,0,1,0,0,215,484
EDO. MERIDA,CE. LIBERTADOR,PQ. ARIAS,UNIDAD EDUC ELOY CHALBAUD,1992,4,32,1762,847,1730,0,3,1,1,878,1762
EDO. MERIDA,CE. LIBERTADOR,PQ. EL MORRO,ESCUELA ESTADAL NO 255,269,1,3,226,173,223,0,1,0,0,49,226
EDO. MERIDA,CE. LIBERTADOR,PQ. EL MORRO,ESCUELA BAS EST EL HATICO,82,1,3,59,49,56,0,0,0,0,7,59
EDO. MERIDA,CE. LIBERTADOR,PQ. EL MORRO,CONC AUGUSTO MALAVE VILLALBA,153,1,0,116,95,116,0,0,0,0,21,116
EDO. MERIDA,CE. LIBERTADOR,PQ. EL MORRO,GRUPO ESCOLAR JUAN DE DIOS DAVILA,795,2,13,642,356,629,0,1,0,0,272,642
EDO. MERIDA,CE. LIBERTADOR,PQ. EL MORRO,ESCUELA ESTADAL NO 384
EDO. MERIDA,CE. LIBERTADOR,PQ. CARACCIOLO PARRA P,ESCUELA BASICA FERMIN RUIZ VALERO B,1471,3,16,1331,289,1315,1,2,1,1,1021,1331
EDO. MERIDA,CE. LIBERTADOR,PQ. CARACCIOLO PARRA P,JARDIN DE INF ELOY PAREDES,1744,3,15,1548,288,1533,0,1,0,0,1244,1548
EDO. MERIDA,CE. LIBERTADOR,PQ. CARACCIOLO PARRA P,ESCUELA BASICA FERMIN RUIZ VALERO,3213,6,24,2767,662,2743,0,5,2,2,2072,2767
EDO. MERIDA,CE. LIBERTADOR,PQ. CARACCIOLO PARRA P,ESCUELA. BASICA. ELOY PAREDES,3269,6,37,2731,505,2694,1,7,1,3,2177,2731
EDO. MERIDA,CE. LIBERTADOR,PQ. CARACCIOLO PARRA P,ESCUELA BASICA ELOY PAREDES (B),1260,3,9,1144,258,1135,0,2,0,1,874,1144
EDO. MERIDA,CE. LIBERTADOR,PQ. LOS NEVADOS,ESCUELA ESTADAL NUMERO 152,619,2,15,476,350,461,0,0,0,0,111,476
EDO. MERIDA,CE. LIBERTADOR,PQ. GONZALO PICON FEBRES,ESCUELA MUNICIPAL MARIA ADELA DE VIELMA,865,2,30,755,334,725,0,3,0,0,388,755
EDO. MERIDA,CE. LIBERTADOR,PQ. GONZALO PICON FEBRES,ESCUELA ESTADAL NUMERO 398,616,2,9,536,238,527,0,0,0,0,289,536
EDO. MERIDA,CE. LIBERTADOR,PQ. GONZALO PICON FEBRES,UNIDAD EDUCATIVA VITALIA GUTIERREZ DE R,2329,4,33,1941,911,1908,3,7,0,0,987,1941
EDO. MERIDA,CE. LIBERTADOR,PQ. GONZALO PICON FEBRES,ESCUELA BASICA EL PLAYON NUMERO 94,1103,2,17,950,381,933,1,4,2,0,545,950
EDO. MERIDA,CE. LIBERTADOR,PQ. MILLA,UNIDAD EDUCATIVA DOCTOR RAMON REINOZO NUÑEZ (B),945,2,10,839,331,829,1,5,0,1,491,839
EDO. MERIDA,CE. LIBERTADOR,PQ. MILLA,COLEGIO SAN JOSE DE LA SIERRA,1388,3,18,1225,325,1207,2,3,0,2,875,1225
EDO. MERIDA,CE. LIBERTADOR,PQ. MILLA,ESCUELA BASICA CAMILO CONTRERAS,2571,5,53,2182,926,2129,0,7,0,0,1196,2182
EDO. MERIDA,CE. LIBERTADOR,PQ. MILLA,JARDIN DE INFANCIA VICENTE DAVILA,1026,2,7,865,339,858,0,6,0,1,512,865
EDO. MERIDA,CE. LIBERTADOR,PQ. MILLA,ESCUELA BASICA DOCTOR RAMON REINOSO NUEZ,3292,6,47,2766,1075,2719,1,16,1,0,1626,2766
EDO. MERIDA,CE. LIBERTADOR,PQ. MILLA,ESCUELA BASICA VICENTE DAVILA,3645,7,52,2897,900,2845,4,15,2,4,1920,2897
EDO. MERIDA,CE. LIBERTADOR,PQ. MILLA,LICEO ROMULO GALLEGOS,2246,4,20,1931,536,1911,1,3,0,2,1369,1931
EDO. MERIDA,CE. LIBERTADOR,PQ. MILLA,ESCUELA BASICA GLADYS C LOBO DE CARNEVALLI,2009,4,31,1681,564,1650,1,5,0,0,1080,1681
EDO. MERIDA,CE. LIBERTADOR,PQ. MILLA,UNIDAD EDUCATIVA COLEGIO SAGRADA FAMILIA
EDO. MERIDA,CE. LIBERTADOR,PQ. MARIANO PICON SALAS,ESCUELA BOLIVARIANA HUMBERTO TEJERA,3424,6,44,2996,781,2952,1,9,0,0,2161,2996
EDO. MERIDA,CE. LIBERTADOR,PQ. MARIANO PICON SALAS,ESCUELA DEPORTIVA,2863,5,26,2502,606,2476,2,9,1,2,1856,2502
EDO. MERIDA,CE. LIBERTADOR,PQ. MARIANO PICON SALAS,ESCUELA BASICA AMADO GONZALEZ,1522,3,21,1270,362,1249,1,4,0,0,882,1270
EDO. MERIDA,CE. LIBERTADOR,PQ. MARIANO PICON SALAS,LICEO EXPERIM FRAY J RAMOS DE LORA,1124,2,18,963,297,945,2,3,0,0,643,963
EDO. MERIDA,CE. LIBERTADOR,PQ. MARIANO PICON SALAS,UNID EDUC EL RINCON,820,2,10,705,343,695,0,0,0,0,352,705
EDO. MERIDA,CE. LIBERTADOR,PQ. EL LLANO,LICEO LIBERTADOR (B),2017,4,15,1745,523,1730,0,10,1,0,1196,1745
EDO. MERIDA,CE. LIBERTADOR,PQ. EL LLANO,UNIDAD EDUCATIVA NUESTRA SEÑORA  DE FATIMA,1650,3,13,1450,273,1437,0,1,1,2,1160,1450
EDO. MERIDA,CE. LIBERTADOR,PQ. EL LLANO,UNIDAD EDUCATIVA LA SALLE,3037,6,37,2535,571,2498,0,8,0,1,1918,2535
EDO. MERIDA,CE. LIBERTADOR,PQ. EL LLANO,UNIDAD EDUCATIVA. COLEGIO LA SALLE B,707,2,3,652,114,649,0,1,1,1,532,652
EDO. MERIDA,CE. LIBERTADOR,PQ. EL LLANO,LICEO NACIONAL LIBERTADOR,3914,7,45,3116,834,3071,1,10,1,1,2224,3116
EDO. MERIDA,CE. LIBERTADOR,PQ. DOMINGO PE#A,ESCUELA  BASICA GONZALO PICON FEBRES,1490,3,12,1268,396,1256,1,8,0,0,851,1268
EDO. MERIDA,CE. LIBERTADOR,PQ. DOMINGO PE#A,PRE ESCOLAR NIÑO SIMON,224,1,5,199,85,194,0,0,0,0,109,199
EDO. MERIDA,CE. LIBERTADOR,PQ. DOMINGO PE#A,DEPARTAMENTO DE EDUCACION PARA ADULTO,434,1,4,357,106,353,0,0,0,0,247,357
EDO. MERIDA,CE. LIBERTADOR,PQ. DOMINGO PE#A,ESCUELA BASICA NACIONAL JUAN RUIZ FAJARDO,3010,6,42,2623,860,2581,0,7,1,1,1712,2623
EDO. MERIDA,CE. LIBERTADOR,PQ. DOMINGO PE#A,ESCUELA TECNICA MANUEL ANTONIO PULIDO MENDEZ,3387,6,24,3018,920,2994,1,6,0,2,2065,3018
EDO. MERIDA,CE. LIBERTADOR,PQ. DOMINGO PE#A,UNIDAD  EDUCATIVA 5 DE JULIO,1706,3,17,1419,529,1402,1,4,0,1,867,1419
EDO. MERIDA,CE. LIBERTADOR,PQ. DOMINGO PE#A,ESCUELA  BASICA FILOMENA DAVILA,1954,4,27,1755,629,1728,0,8,1,2,1088,1755
EDO. MERIDA,CE. LIBERTADOR,PQ. DOMINGO PE#A,UNIDAD EDUCATIVA MARIA MOZZARELLO,1595,3,38,1436,619,1398,0,5,0,0,774,1436
EDO. MERIDA,CE. LIBERTADOR,PQ. DOMINGO PE#A,ESCUELA  BASICA 15 DE ENERO,937,2,14,845,433,831,0,4,1,1,392,845
EDO. MERIDA,CE. LIBERTADOR,PQ. DOMINGO PE#A,ESCUELA  BASICA RAFAEL ANTONIO GODOY,3037,6,36,2509,774,2473,2,8,1,3,1685,2509
EDO. MERIDA,CE. LIBERTADOR,PQ. DOMINGO PE#A,UNIDAD  EDUCATIVA ANTONIO N RANGEL,1497,3,19,1291,574,1272,0,6,0,0,692,1291
EDO. MERIDA,CE. LIBERTADOR,PQ. JACINTO PLAZA,GRUPO ESCOLAR EL EDUCADOR (B),435,1,2,372,220,370,0,1,0,0,149,372
EDO. MERIDA,CE. LIBERTADOR,PQ. JACINTO PLAZA,U.E. BOLIVARIANA MAHATMA GANDHI,455,1,9,395,280,386,0,3,0,0,103,395
EDO. MERIDA,CE. LIBERTADOR,PQ. JACINTO PLAZA,GRUPO ESCOLAR EL EDUCADOR,3755,7,67,3164,1493,3097,1,21,0,0,1582,3164
EDO. MERIDA,CE. LIBERTADOR,PQ. JACINTO PLAZA,ESC BAS JUAN DE ARCO,2882,5,52,2380,1256,2328,1,9,4,0,1058,2380
EDO. MERIDA,CE. LIBERTADOR,PQ. JACINTO PLAZA,ESCUELA BASICA GRADUADA SIMON RODRIGUEZ,3816,7,62,3087,1721,3025,1,12,4,2,1285,3087
EDO. MERIDA,CE. LIBERTADOR,PQ. JACINTO PLAZA,UNIDAD EDUCATIVASAN RAFAEL DEL CHAMA,287,1,4,265,178,261,0,1,0,0,82,265
EDO. MERIDA,CE. LIBERTADOR,PQ. JACINTO PLAZA,UNID EDUC ANDRES ELOY BLANCO,4399,8,75,3730,1831,3655,3,17,0,1,1803,3730
EDO. MERIDA,CE. LIBERTADOR,PQ. JACINTO PLAZA,UNIDAD EDUCATIVA JUANA DE ARCO (B),1421,3,24,1220,704,1196,0,1,3,0,488,1220
EDO. MERIDA,CE. LIBERTADOR,PQ. ANTONIO SPINETTI DINI,LICEO PRIVADO MONSEÑOR SILVA,4019,7,37,3360,751,3323,0,6,0,4,2562,3360
EDO. MERIDA,CE. LIBERTADOR,PQ. ANTONIO SPINETTI DINI,UNIDAD LARGA ESTANCIA,544,1,3,442,227,439,0,1,1,0,210,442
EDO. MERIDA,CE. LIBERTADOR,PQ. ANTONIO SPINETTI DINI,ESCUELA BASICA ELEAZAR LOPEZ CONTRERAS,2656,5,45,2237,712,2192,1,6,1,2,1470,2237
EDO. MERIDA,CE. LIBERTADOR,PQ. ANTONIO SPINETTI DINI,UNIDAD EDUCATIVA EMIRO FUENMAYOR,2799,5,47,2259,1091,2212,1,10,0,4,1106,2259
EDO. MERIDA,CE. LIBERTADOR,PQ. ANTONIO SPINETTI DINI,ESCUELA BASICA JOSEFA MOLINA DE DUQUE,2912,5,35,2488,778,2453,0,5,3,0,1667,2488
EDO. MERIDA,CE. LIBERTADOR,PQ. ANTONIO SPINETTI DINI,UNIDAD EDUCATIVA ALBERTO CARNEVALI,2038,4,29,1804,751,1775,1,3,0,1,1019,1804
EDO. MERIDA,CE. LIBERTADOR,PQ. ANTONIO SPINETTI DINI,ESCUELA BASICA DOÑA MARCOLINA DE LAMUS,1004,2,15,856,398,841,1,1,0,0,441,856
EDO. MERIDA,CE. LIBERTADOR,PQ. ANTONIO SPINETTI DINI,UNIDAD EDUCATIVA COLEGIO MADRE EMILIA,2166,4,10,1971,413,1961,0,3,0,0,1545,1971
EDO. MERIDA,CE. LIBERTADOR,PQ. ANTONIO SPINETTI DINI,ESCUELA TECNICA  ROBINSONIANA SIMON RODRIGUEZ,415,1,7,364,165,357,0,1,0,0,191,364
EDO. MERIDA,CE. LIBERTADOR,PQ. ANTONIO SPINETTI DINI,UNIDAD EDUCATIVA BASICA MONSEÑOR DOCTOR  SANTIAGO HERNANDEZ MILANEZ,1652,3,25,1415,643,1390,0,6,0,0,741,1415
EDO. MERIDA,CE. LIBERTADOR,PQ. JUAN RODRIGUEZ SUAREZ,CICLO BASICO CARACCIOLO PARRA OLMEDO,3539,7,34,2972,502,2938,1,7,1,2,2425,2972
EDO. MERIDA,CE. LIBERTADOR,PQ. JUAN RODRIGUEZ SUAREZ,ESCUELA BASICA CECILIO ACOSTA,1955,4,17,1711,290,1694,0,3,0,1,1400,1711
EDO. MERIDA,CE. LIBERTADOR,PQ. JUAN RODRIGUEZ SUAREZ,UNIDAD EDUCATIVA CARACIOLO PARRA Y OLMEDO (B),1325,3,12,1193,244,1181,2,3,1,1,930,1193
EDO. MERIDA,CE. LIBERTADOR,PQ. JUAN RODRIGUEZ SUAREZ,PRE ESCOLAR DON ANDRES BELLO,805,2,4,744,165,740,0,1,0,0,574,744
EDO. MERIDA,CE. LIBERTADOR,PQ. JUAN RODRIGUEZ SUAREZ,ESCUELA  BASICA ZUMBA,1578,3,23,1384,436,1361,1,5,1,0,918,1384
EDO. MERIDA,CE. LIBERTADOR,PQ. JUAN RODRIGUEZ SUAREZ,COLEGIO N SRA DEL ROSARIO,2163,4,21,1889,339,1868,0,3,1,2,1523,1889
EDO. MERIDA,CE. LIBERTADOR,PQ. JUAN RODRIGUEZ SUAREZ,GRUPO ESCOLAR ESTADO LARA,2353,4,16,2040,341,2024,0,3,1,0,1679,2040
EDO. MERIDA,CE. LIBERTADOR,PQ. LASSO DE LA VEGA,ESC BAS RAMON PARRA PICON,3300,6,40,2784,1053,2744,0,8,1,2,1680,2784
EDO. MERIDA,CE. LIBERTADOR,PQ. LASSO DE LA VEGA,UNIDAD EDUCATIVA RAMON IGNAGIO GUERRA (B),2253,4,35,2020,622,1985,1,8,1,0,1353,2020
EDO. MERIDA,CE. LIBERTADOR,PQ. LASSO DE LA VEGA,ESCUELA BASICA RAMON IGNACIO GUERRA.,3019,6,41,2560,763,2519,0,6,0,3,1747,2560
EDO. MERIDA,CE. LIBERTADOR,PQ. OSUNA RODRIGUEZ,ESCUELA BASICA LOS CUROS,3242,6,41,2709,1175,2668,2,8,1,0,1482,2709
EDO. MERIDA,CE. LIBERTADOR,PQ. OSUNA RODRIGUEZ,UNIDAD EDUCATIVA  BICENTENARIO DEL LIBERTADOR,866,2,14,778,403,764,0,5,0,0,356,778
EDO. MERIDA,CE. LIBERTADOR,PQ. OSUNA RODRIGUEZ,ESCUELA BASICA 10 DE DICIEMBRE,2139,4,37,1816,809,1779,0,5,2,0,963,1816
EDO. MERIDA,CE. LIBERTADOR,PQ. OSUNA RODRIGUEZ,UNIDAD EDUCATIVA ROMULO BETANCOURT B,804,2,11,712,334,701,0,3,1,0,363,712
EDO. MERIDA,CE. LIBERTADOR,PQ. OSUNA RODRIGUEZ,UNIDAD EDUCATIVA ROMULO BETANCOURT,2984,6,53,2579,1170,2526,0,7,1,0,1348,2579
EDO. MERIDA,CE. LIBERTADOR,PQ. OSUNA RODRIGUEZ,ESCUELA BASICA LOS CUROS (B),1919,4,32,1654,829,1622,0,2,1,1,789,1654
EDO. MERIDA,CE. LIBERTADOR,PQ. SAGRARIO,ESCUELA UNIDAD EDUCATIVA ESTADAL COROMOTO,2438,5,42,1981,618,1939,0,4,1,3,1313,1981
EDO. MERIDA,CE. LIBERTADOR,PQ. SAGRARIO,ESCUELA BASICA  GABRIEL PICON GONZALEZ,2773,5,31,2274,597,2243,0,8,1,2,1635,2274
EDO. MERIDA,MP. PUEBLO LLANO,CM. PUEBLO LLANO,ESCUELA BOLIVARIANA ADELA BASTIDAS,180,1,2,166,103,164,0,0,0,0,61,166
EDO. MERIDA,MP. PUEBLO LLANO,CM. PUEBLO LLANO,ESCUELA BASICA BOLIVARIANA  FOCION F CORDERO,2751,5,45,2272,1004,2227,1,6,0,0,1216,2272
EDO. MERIDA,MP. PUEBLO LLANO,CM. PUEBLO LLANO,UNIDAD EDUCATIVA BOLIVARIANA MUTUS,1143,2,19,983,472,964,0,1,0,0,491,983
EDO. MERIDA,MP. PUEBLO LLANO,CM. PUEBLO LLANO,UNIDAD EDUCATIVA LA CULATA,1412,3,27,1169,658,1142,0,5,0,0,479,1169
EDO. MERIDA,MP. PUEBLO LLANO,CM. PUEBLO LLANO,UNIDAD DUCATIVA BOLIVARIANA MIYOY,125,1,3,116,73,113,0,0,0,0,40,116
EDO. MERIDA,MP. PUEBLO LLANO,CM. PUEBLO LLANO,ESCUELA BOLIVARIANA LA CAPELLANIA,1538,3,17,1256,707,1239,0,1,1,0,530,1256
EDO. MERIDA,MP.OB. RAMOS DE LORA,PQ. PQ R DE ALCAZAR,ESC BAS CONC MIXTA MATA DE COCO,887,2,8,674,406,666,0,2,0,0,258,674
EDO. MERIDA,MP.OB. RAMOS DE LORA,PQ. PQ R DE ALCAZAR,UNIDAD EDUCATIVA BOLIVARIANA PUEBLO NUEVO 1,141,1,1,127,86,126,0,1,0,0,39,127
EDO. MERIDA,MP.OB. RAMOS DE LORA,PQ. PQ R DE ALCAZAR,UNIDAD EDUCATIVA LA PROVIDENCIA,522,1,9,380,231,371,0,1,0,0,139,380
EDO. MERIDA,MP.OB. RAMOS DE LORA,PQ. PQ R DE ALCAZAR,ESC BAS COMB GUACHIZON II,651,2,6,509,263,503,0,2,1,0,237,509
EDO. MERIDA,MP.OB. RAMOS DE LORA,PQ. PQ R DE ALCAZAR,ESCUELA BASICA SAN RAFAEL DE ALCAZAR,1670,3,27,1306,815,1279,0,1,0,0,463,1306
EDO. MERIDA,MP.OB. RAMOS DE LORA,CM. STA ELENA DE ARENALES,INSTITUTO DE EDUCACION ESPECIAL BOLIVARIANO IROSKA APOLINAR DE PORRAS,348,1,6,288,191,282,0,2,0,0,89,288
EDO. MERIDA,MP.OB. RAMOS DE LORA,CM. STA ELENA DE ARENALES,UNIDAD EDUCATIVA BOLIVARIANA CAPAZON ARRIBA,707,2,8,554,340,546,0,1,0,0,205,554
EDO. MERIDA,MP.OB. RAMOS DE LORA,CM. STA ELENA DE ARENALES,UNIDAD EDUCATIVA BOLIVARIANA MARIA DE JESUS NOGUERA DE TORRES,399,1,4,306,203,302,0,0,1,0,98,306
EDO. MERIDA,MP.OB. RAMOS DE LORA,CM. STA ELENA DE ARENALES,UNIDAD EDUCATIVA J J OSUNA RODRIGUEZ,1519,3,23,1291,674,1268,0,8,0,3,583,1291
EDO. MERIDA,MP.OB. RAMOS DE LORA,CM. STA ELENA DE ARENALES,ESCUELA BOLIVARIANA MARIA TERESA DEL TORO,308,1,8,283,222,275,0,0,0,0,53,283
EDO. MERIDA,MP.OB. RAMOS DE LORA,CM. STA ELENA DE ARENALES,ESCUELA ESTADAL SANTA ELENA ABAJO,205,1,1,186,172,185,0,0,0,0,13,186
EDO. MERIDA,MP.OB. RAMOS DE LORA,CM. STA ELENA DE ARENALES,ESCUELA BASICA DOCTOR MARIANO UZCATEGUI,2534,5,31,2060,1018,2029,0,5,1,0,1005,2060
EDO. MERIDA,MP.OB. RAMOS DE LORA,CM. STA ELENA DE ARENALES,ESCUELA NACIONAL NO 1427,678,2,5,555,319,550,0,2,0,0,229,555
EDO. MERIDA,MP.OB. RAMOS DE LORA,CM. STA ELENA DE ARENALES,NER 109,1044,2,6,795,564,789,0,7,1,0,217,795
EDO. MERIDA,MP.OB. RAMOS DE LORA,CM. STA ELENA DE ARENALES,ESC BAS CONC MIXTA,884,2,10,707,323,697,0,1,0,0,373,707
EDO. MERIDA,MP.OB. RAMOS DE LORA,CM. STA ELENA DE ARENALES,UNIDAD EDUCATIVA COLEGIO CRISTO REY,833,2,15,716,427,701,0,5,0,0,269,716
EDO. MERIDA,MP.OB. RAMOS DE LORA,PQ. ELOY PAREDES,UNIDAD EDUCATIVA BOLIVARIANA ANTONIO VERDI,788,2,2,640,413,638,0,6,0,0,219,640
EDO. MERIDA,MP.OB. RAMOS DE LORA,PQ. ELOY PAREDES,LICEO CARLOS ERNESTO MORALES,604,2,11,506,305,495,0,1,0,0,189,506
EDO. MERIDA,MP.OB. RAMOS DE LORA,PQ. ELOY PAREDES,UNIDAD EDUCATIVA DON PEDRO JESUS PINO,2166,4,23,1772,944,1749,0,14,2,1,788,1772
EDO. MERIDA,MP.OB. RAMOS DE LORA,PQ. ELOY PAREDES,UNIDAD EDUCATIVA BOLIVARIANA CAÑO RICO,695,2,6,561,368,555,0,2,0,0,185,561
EDO. MERIDA,MP.OB. RAMOS DE LORA,PQ. ELOY PAREDES,UNIDAD EDUCATIVA BOLIVARIANA CANO OBISPO,88,1,1,82,57,81,0,0,0,0,24,82
EDO. MERIDA,MP.OB. RAMOS DE LORA,PQ. ELOY PAREDES,ESCUELA ESTADAL CANO RICITO,119,1,0,107,97,107,0,0,0,0,10,107
EDO. MERIDA,MP.OB. RAMOS DE LORA,PQ. ELOY PAREDES,UNIDAD EDUCATIVA BOLIVARIANA EL CRUCERO,278,1,3,190,132,187,0,0,0,0,55,190
EDO. MERIDA,MP.OB. RAMOS DE LORA,PQ. ELOY PAREDES,ESCUELA BOLIVARIANA LOMA DE PIEDRA,436,1,3,358,206,355,0,1,0,0,148,358
EDO. MERIDA,MP. SUCRE,PQ. CHIGUARA,UNIDAD EDUCATIVA LLANO EL ANIS,885,2,27,760,459,733,0,3,0,0,271,760
EDO. MERIDA,MP. SUCRE,PQ. CHIGUARA,ESC BAS NAC 242 SAN JOSE,241,1,2,190,161,188,0,0,0,0,27,190
EDO. MERIDA,MP. SUCRE,PQ. CHIGUARA,GRUPO ESCOLAR ESTADO NUEVA ESPARTA,3205,6,71,2597,1183,2526,1,4,1,1,1336,2597
EDO. MERIDA,MP. SUCRE,PQ. CHIGUARA,UNIDAD EDUCATIVA LICEO BOLIVARIANO FRANCISCO A UZCATEGUI,266,1,5,238,119,233,0,0,0,0,114,238
EDO. MERIDA,MP. SUCRE,PQ. CHIGUARA,ES EST BAS EL REMOLINO,454,1,4,337,246,333,0,4,2,0,81,337
EDO. MERIDA,MP. SUCRE,PQ. CHIGUARA,ESCUELA ESTADAL BASICA NUMERO 1294,153,1,4,98,82,94,0,0,0,0,12,98
EDO. MERIDA,MP. SUCRE,PQ. CHIGUARA,U E AGUA LINDA,401,1,5,342,215,337,0,0,0,0,122,342
EDO. MERIDA,MP. SUCRE,PQ. CHIGUARA,ESCUELA ESTADAL EL VERDE,185,1,2,134,45,132,0,0,0,0,87,134
EDO. MERIDA,MP. SUCRE,PQ. PUEBLO NUEVO DEL SUR,ESCUELA ESTADAL BOLIVARIANA LOS AMARILLOS,580,1,5,422,292,417,0,1,1,0,123,422
EDO. MERIDA,MP. SUCRE,PQ. PUEBLO NUEVO DEL SUR,ESCUELA NACIONAL UNITARIA NO 1273,165,1,2,98,72,96,0,0,1,0,23,98
EDO. MERIDA,MP. SUCRE,PQ. PUEBLO NUEVO DEL SUR,ESCUELA ESTADAL BOLIVARIANA EL HORCAZ,139,1,1,128,90,127,0,2,0,0,35,128
EDO. MERIDA,MP. SUCRE,PQ. PUEBLO NUEVO DEL SUR,UNIDAD EDUCATIVA GENARINA DUGARTE C,870,2,8,636,322,628,0,3,0,2,301,636
EDO. MERIDA,MP. SUCRE,PQ. PUEBLO NUEVO DEL SUR,ESCUELA CONCENTRADA MIXTA,246,1,2,174,111,172,0,0,0,0,61,174
EDO. MERIDA,MP. SUCRE,PQ. PUEBLO NUEVO DEL SUR,UNIDAD EDUCATIVA BOLIVARIANA EL CAMBUR 2380,294,1,2,218,215,216,0,0,0,0,1,218
EDO. MERIDA,MP. SUCRE,PQ. PUEBLO NUEVO DEL SUR,UNIDAD EDUCATIVA LA AGUADA,131,1,0,90,82,90,0,0,0,0,8,90
EDO. MERIDA,MP. SUCRE,PQ. PUEBLO NUEVO DEL SUR,ESCUELA ESTADAL NO 126,229,1,2,190,165,188,0,0,0,0,23,190
EDO. MERIDA,MP. SUCRE,CM. LAGUNILLAS,UNIDA EDUCATIVA BOLIVARAIANA EL MOLINO,2310,4,25,1881,1104,1856,0,9,0,0,743,1881
EDO. MERIDA,MP. SUCRE,CM. LAGUNILLAS,U.E.COLEGIO CIUDAD DE LAGUNILLAS,1877,4,43,1504,721,1461,1,6,1,1,731,1504
EDO. MERIDA,MP. SUCRE,CM. LAGUNILLAS,ESC BASICA MANUEL GUAL,3124,6,49,2597,1363,2548,1,10,0,1,1173,2597
EDO. MERIDA,MP. SUCRE,CM. LAGUNILLAS,LICEO BOLIVARIANO LUIS E MARQUEZ B,2598,5,32,2045,1002,2013,2,9,1,1,998,2045
EDO. MERIDA,MP. SUCRE,CM. LAGUNILLAS,ESCUELA BASICA UNIDAD EDUCATIVA LOS ARAQUES,608,2,11,495,322,484,0,2,0,0,160,495
EDO. MERIDA,MP. SUCRE,CM. LAGUNILLAS,ESCUELA BASICA MANUEL GUAL (B),1214,3,17,1019,582,1002,0,3,1,1,415,1019
EDO. MERIDA,MP. SUCRE,CM. LAGUNILLAS,UNIDAD EDUCATIVA FERMIN TORO,766,2,12,684,486,672,0,3,0,0,183,684
EDO. MERIDA,MP. SUCRE,CM. LAGUNILLAS,JARDIN INFANCIA MANUEL GUAL ANEXO SAN MARTIN,400,1,5,339,266,334,0,1,0,0,67,339
EDO. MERIDA,MP. SUCRE,CM. LAGUNILLAS,ESCUELA BASICA ESTADAL UNITARIA LOS UVITOS,225,1,3,124,83,121,0,0,0,0,38,124
EDO. MERIDA,MP. SUCRE,CM. LAGUNILLAS,UNIDAD EDUCATIVA BOLIVARIANA 24 DE JUNIO,891,2,28,788,435,760,0,8,0,1,316,788
EDO. MERIDA,MP. SUCRE,PQ. SAN JUAN,INTERNADO JUDICIAL,164,1,1,45,31,44,0,0,0,0,13,45
EDO. MERIDA,MP. SUCRE,PQ. SAN JUAN,JARDIN DE INFANCIA ESTADO PORTUGUESA,221,1,2,191,126,189,0,0,0,0,63,191
EDO. MERIDA,MP. SUCRE,PQ. SAN JUAN,PRE ESCOLAR VILLA LIBERTAD,596,1,9,506,278,497,0,2,0,0,217,506
EDO. MERIDA,MP. SUCRE,PQ. SAN JUAN,E.B. ESTADO PORTUGUESA B,619,2,16,536,302,520,0,3,0,0,215,536
EDO. MERIDA,MP. SUCRE,PQ. SAN JUAN,UNIDAD EDUCATIVA FRANCISCO DE MIRANDA,671,2,27,602,385,575,0,4,0,0,186,602
EDO. MERIDA,MP. SUCRE,PQ. SAN JUAN,U E OBISPO ARIAS,522,1,13,436,235,423,0,1,0,0,187,436
EDO. MERIDA,MP. SUCRE,PQ. SAN JUAN,ESCUELA BASICA ESTADAL PORTUGUESA (B),1776,3,29,1524,877,1495,0,11,0,0,607,1524
EDO. MERIDA,MP. SUCRE,PQ. SAN JUAN,ESCUELA BASICA ESTADO PORTUGUESA,2838,5,41,2188,1200,2147,0,10,2,1,934,2188
EDO. MERIDA,MP. SUCRE,PQ. ESTANQUES,ESC BAS EST NO 246,419,1,8,338,160,330,2,1,0,0,167,338
EDO. MERIDA,MP. SUCRE,PQ. ESTANQUES,ESCUELA ESTADAL BASICA 1133 RINCON DEL PALMAR,336,1,0,225,199,225,0,0,0,0,26,225
EDO. MERIDA,MP. SUCRE,PQ. ESTANQUES,ESCUELA ESTADAL NUMERO 107,286,1,1,205,173,204,0,0,0,0,31,205
EDO. MERIDA,MP. SUCRE,PQ. ESTANQUES,UNIDAD EDUCATIVA SANTO DOMINGO,151,1,1,131,94,130,0,0,0,0,36,131
EDO. MERIDA,MP. SUCRE,PQ. ESTANQUES,CONCENTRACION ESCOLAR ESTANQUEZ,995,2,14,793,424,779,0,3,0,0,352,793
EDO. MERIDA,MP. SUCRE,PQ. ESTANQUES,ESCUELA ESTADAL LAS LABRANZAS NUMERO 058,204,1,3,153,111,150,0,1,0,0,38,153
EDO. MERIDA,MP. SUCRE,PQ. ESTANQUES,ESCUELA ESTADAL EL HATO,329,1,3,264,123,261,0,4,0,0,134,264
EDO. MERIDA,MP. SUCRE,PQ. ESTANQUES,ESCUELA ESTADAL SAN ANTONIO,211,1,5,171,139,166,0,0,0,0,27,171
EDO. MERIDA,MP. SUCRE,PQ. ESTANQUES,ESCUELA ESTADAL SAN PABLO ALTO,206,1,5,152,112,147,0,0,0,0,35,152
EDO. MERIDA,MP. SUCRE,PQ. LA TRAMPA,ESC BAS ESTADAL NO 51,377,1,6,256,184,250,0,2,0,0,64,256
EDO. MERIDA,MP. SUCRE,PQ. LA TRAMPA,UNIDAD EDUCATIVA LA TRAMPA,500,1,3,374,209,371,0,2,2,0,158,374
EDO. MERIDA,MP. SUCRE,PQ. LA TRAMPA,ESC BASICA ESTADAL NO 441,373,1,2,273,229,271,0,2,2,0,38,273
EDO. MERIDA,MP. SUCRE,PQ. LA TRAMPA,ESCUELA BASICA EL ESTANQUILLO,189,1,5,139,90,134,0,0,0,0,44,139
EDO. MERIDA,MP. SUCRE,PQ. LA TRAMPA,ESCUELA BASICA ESTADAL BELEN,133,1,2,107,51,105,0,0,0,0,54,107
EDO. MERIDA,MP. SUCRE,PQ. LA TRAMPA,ESCUELA BASICA ESTADAL NO 174,148,1,7,103,81,96,0,1,0,0,14,103
EDO. MERIDA,MP. MIRANDA,PQ. PI#ANGO,UNIDAD EDUCATIVA BOLIVARIANA DR IGNACIO FERNANDEZ PENA,524,1,6,449,227,443,0,3,0,0,213,449
EDO. MERIDA,MP. MIRANDA,PQ. PI#ANGO,UNIDAD EDUCATIVA EL ARBOLITO,259,1,3,216,180,213,0,0,0,0,33,216
EDO. MERIDA,MP. MIRANDA,PQ. PI#ANGO,ESCUELA ESTADAL NO 108,164,1,1,136,96,135,1,0,0,0,38,136
EDO. MERIDA,MP. MIRANDA,PQ. PI#ANGO,ESCUELA LAS TAPIAS,135,1,4,119,41,115,0,0,0,1,73,119
EDO. MERIDA,MP. MIRANDA,PQ. LA VENTA,UNIDAD EDUCATIVA BOLIVARIANA LA VENTA,950,2,17,794,309,777,0,7,0,0,461,794
EDO. MERIDA,MP. MIRANDA,PQ. LA VENTA,ESCUELA ESTADAL BOLIVARIANA CRUZ CHIQUITA,307,1,8,239,116,231,0,1,0,0,114,239
EDO. MERIDA,MP. MIRANDA,PQ. ANDRES ELOY BLANCO,UNIDAD EDUCATIVA EMILIO MALDONADO,1594,3,33,1242,554,1209,0,10,1,1,643,1242
EDO. MERIDA,MP. MIRANDA,CM. CHACHOPO,ESCUELA BASICA FILOMENA RUIZ DE RODRIGUEZ,2360,4,37,2051,924,2014,0,5,0,1,1084,2051
EDO. MERIDA,MP. MIRANDA,CM. CHACHOPO,UNIDAD EDUCATIVA FRANCISCO DE PAULA ANDRADE,2414,5,71,2057,866,1986,0,7,1,0,1112,2057
EDO. MERIDA,MP. MIRANDA,CM. CHACHOPO,ESCUELA ESTADAL TAFALLEZ,288,1,4,257,177,253,0,0,0,0,76,257
EDO. MERIDA,MP. MIRANDA,CM. CHACHOPO,GRUPO ESCOLAR CANONIGO UZCATEGUI,2515,5,56,2033,1019,1977,0,6,0,1,951,2033
EDO. MERIDA,MP. MIRANDA,CM. CHACHOPO,UNIDAD EDUCATIVA LA JOYA,658,2,13,551,223,538,0,4,2,0,309,551
EDO. MERIDA,MP. MIRANDA,CM. CHACHOPO,ESCUELA NACIONAL BOLIVARIANA LAS MESAS,280,1,3,237,88,234,0,0,0,0,146,237
EDO. MERIDA,MP. MIRANDA,CM. CHACHOPO,UNIDAD EDUCATIVA LA VEGA,199,1,2,180,134,178,1,0,1,1,41,180
EDO. MERIDA,MP. MIRANDA,CM. CHACHOPO,ESCUELA ESTADAL BOLIVARIANA MESA CERRADA,749,2,15,656,438,641,1,3,2,0,197,656
EDO. MERIDA,MP. MIRANDA,CM. CHACHOPO,ESCUELA  ESTADAL SANTA CRUZ DE TAFALLEZ,187,1,5,133,94,128,0,1,0,0,33,133
EDO. MERIDA,MP. MIRANDA,CM. CHACHOPO,UNIDAD EDUCATIVA NACIONAL CHIJOS,1300,3,32,1139,663,1107,1,4,1,0,438,1139
EDO. MERIDA,MP.JULIO CESAR SALAS,PQ. PALMIRA,ESCUELA PRIMARIA ESTADAL EL CERRO,703,2,3,547,299,544,0,2,0,0,243,547
EDO. MERIDA,MP.JULIO CESAR SALAS,PQ. PALMIRA,UNIDAD EDUCATIVA PALMIRA,1057,2,8,859,562,851,0,3,0,0,286,859
EDO. MERIDA,MP.JULIO CESAR SALAS,PQ. PALMIRA,UNIDAD EDUCATIVA PALMIRA B,159,1,1,140,92,139,0,0,0,0,47,140
EDO. MERIDA,MP.JULIO CESAR SALAS,CM. ARAPUEY,INSTITUTO DE EDUCACION ESPECIAL ARAPUEY,1230,3,42,944,601,902,0,0,1,0,300,944
EDO. MERIDA,MP.JULIO CESAR SALAS,CM. ARAPUEY,ESCUELA ESTADAL LA ARENOSA,171,1,3,149,121,146,0,1,0,0,24,149
EDO. MERIDA,MP.JULIO CESAR SALAS,CM. ARAPUEY,ESCUELA ESTADAL SAN MIGUEL,899,2,15,699,402,684,0,2,0,0,280,699
EDO. MERIDA,MP.JULIO CESAR SALAS,CM. ARAPUEY,ESCUELA PRIMARIA ROBERTO PICON LARES,2480,5,24,1765,1071,1741,0,5,0,0,665,1765
EDO. MERIDA,MP.JULIO CESAR SALAS,CM. ARAPUEY,ESCUELA ESTADAL EL POCO,160,1,5,137,107,132,0,1,0,0,24,137
EDO. MERIDA,MP.JULIO CESAR SALAS,CM. ARAPUEY,LICEO BOLIVARIANO ROBERTO PICON LARES,1285,3,21,1039,681,1018,0,6,0,0,331,1039
EDO. MERIDA,MP.JULIO CESAR SALAS,CM. ARAPUEY,ESCUELA ESTADAL EL QUINCE,778,2,15,576,423,561,0,3,0,0,135,576
EDO. MERIDA,MP.JULIO CESAR SALAS,CM. ARAPUEY,ESCUELA ESTADAL BOLIVARIANA 23 DE ENERO,656,2,8,518,329,510,1,0,0,0,180,518
EDO. MERIDA,MP.JULIO CESAR SALAS,CM. ARAPUEY,ESCUELA ESTADAL LA ALCABALA,285,1,3,251,175,248,1,1,0,0,71,251
EDO. MERIDA,MP.JULIO CESAR SALAS,CM. ARAPUEY,ESCUELA ESTADAL MESA BONITA,81,1,2,73,59,71,0,0,0,0,12,73
EDO. MERIDA,MP. SANTOS MARQUINA,CM. TABAY,UNID EDUC SAN RAFAEL DE TABAY,2383,5,33,1998,974,1965,0,6,0,0,985,1998
EDO. MERIDA,MP. SANTOS MARQUINA,CM. TABAY,ESCUELA ESTADO APURE,3569,7,51,3026,1396,2975,3,8,2,2,1564,3026
EDO. MERIDA,MP. SANTOS MARQUINA,CM. TABAY,ESCUELA BASICA 21 DE NOVIEMBRE,2144,4,58,1836,933,1778,1,5,3,1,835,1836
EDO. MERIDA,MP. SANTOS MARQUINA,CM. TABAY,UNIDAD EDUCATIVA FRANCISCO ZERPA,1016,2,17,873,492,856,0,1,0,1,362,873
EDO. MERIDA,MP. SANTOS MARQUINA,CM. TABAY,ESC BAS NAC 2206 475 Y MUNC 18,837,2,13,722,315,709,1,3,3,1,386,722
EDO. MERIDA,MP. SANTOS MARQUINA,CM. TABAY,LICEO MIGUEL OTERO SILVA,760,2,16,654,406,638,1,3,0,1,227,654
EDO. MERIDA,MP. SANTOS MARQUINA,CM. TABAY,ESC BAS INTEGRAL EL PEDREGAL,834,2,22,709,451,687,0,4,1,0,231,709
EDO. MERIDA,MP. SANTOS MARQUINA,CM. TABAY,UNIDAD EDUCATIVA AQUILES NAZOA,458,1,9,423,238,414,0,2,1,0,173,423
EDO. MERIDA,MP. JUSTO BRICE#O,CM. TORONDOY,ESCUELA BASICA ESTADAL CEIBAL,333,1,3,279,196,276,0,1,0,1,78,279
EDO. MERIDA,MP. JUSTO BRICE#O,CM. TORONDOY,UNIDAD EDUCATIVA ESTADAL SANTA ROSA,635,2,14,494,303,480,0,0,0,0,177,494
EDO. MERIDA,MP. JUSTO BRICE#O,CM. TORONDOY,UNIDAD EDUCATIVA EL JUMANGAL,146,1,2,131,100,129,0,0,0,0,29,131
EDO. MERIDA,MP. JUSTO BRICE#O,CM. TORONDOY,LICEO BOLIVARIANO TORONDOY,1866,4,22,1459,855,1437,0,7,1,0,574,1459
EDO. MERIDA,MP. JUSTO BRICE#O,CM. TORONDOY,ESCUELA BASICA OFICIAL COMBINADA,191,1,0,138,93,138,0,0,0,0,45,138
EDO. MERIDA,MP. JUSTO BRICE#O,CM. TORONDOY,ESCUELA BASICA SANTA ANA,305,1,4,234,172,230,0,1,1,0,56,234
EDO. MERIDA,MP. JUSTO BRICE#O,CM. TORONDOY,UNIDAD EDUCATIVA MUNICIPAL COGOLLAL,225,1,4,179,121,175,0,1,0,0,53,179
EDO. MERIDA,MP. JUSTO BRICE#O,PQ. SAN CRISTOBAL DE T,UNIDAD EDUCATIVA SAN CRISTOBAL,1311,3,21,1082,645,1061,1,0,0,0,415,1082
EDO. MERIDA,MP. CAMPO ELIAS,PQ. MONTALBAN,LICEO EJIDO,3730,7,52,3207,1266,3155,0,6,1,1,1881,3207
EDO. MERIDA,MP. CAMPO ELIAS,PQ. MONTALBAN,ESCUELA BASICA EL SALADO,2460,5,40,2067,1128,2027,0,5,1,0,893,2067
EDO. MERIDA,MP. CAMPO ELIAS,PQ. MONTALBAN,UNIDAD  EDUCATIVA MANZANO BAJO,2311,4,33,1975,999,1942,1,4,0,0,938,1975
EDO. MERIDA,MP. CAMPO ELIAS,PQ. MONTALBAN,UNIDAD GERONTOLOGICA DR RICARDO SERGENT,1328,3,7,1132,448,1125,0,2,0,0,675,1132
EDO. MERIDA,MP. CAMPO ELIAS,PQ. MONTALBAN,UNIDAD EDUCATIVA INTEGRAL JUAN XXIII,1077,2,28,910,456,882,0,1,0,1,424,910
EDO. MERIDA,MP. CAMPO ELIAS,PQ. MONTALBAN,ESCUELA BASICA MONSEÑOR JAUREGUI,4406,8,55,3707,1146,3652,1,9,0,2,2494,3707
EDO. MERIDA,MP. CAMPO ELIAS,PQ. MONTALBAN,ESCUELA BASICA MONSEÑOR JAUREGUI (B),1918,4,28,1736,680,1708,0,4,0,0,1024,1736
EDO. MERIDA,MP. CAMPO ELIAS,PQ. MONTALBAN,ESCUELA NACIONAL DOÑA EDELMIRA QUINTERO DE LOBO,1053,2,11,964,475,953,0,2,0,0,476,964
EDO. MERIDA,MP. CAMPO ELIAS,PQ. MONTALBAN,UNIDAD EDUCATIVA PEDRO J ANDRADE,1503,3,18,1242,722,1224,1,7,0,0,494,1242
