EDO. TRUJILLO,CE. TRUJILLO,PQ. MATRIZ,ESCUELA BOLIVARIANA EL RECREO,N/A,1766,1527,1527,1492,35,N/A,3,0,0,1,5,795,691
EDO. TRUJILLO,CE. TRUJILLO,PQ. MATRIZ,ESCUELA BOLIVARIANA LA URBINA,N/A,201,153,153,148,5,N/A,1,1,0,0,2,24,121
EDO. TRUJILLO,CE. TRUJILLO,PQ. MONSE#OR CARRILLO,ESCUELA BOLIVARIANA MARIO BRICEÑO IRAGORRY,N/A,1955,1577,1577,1553,24,N/A,4,0,0,0,9,733,811
EDO. TRUJILLO,CE. TRUJILLO,PQ. MONSE#OR CARRILLO,ESCUELA ESTADAL CONCENTRADA S N EL COROZO,N/A,149,131,131,131,0,N/A,1,0,0,0,1,8,122
EDO. TRUJILLO,CE. TRUJILLO,PQ. MONSE#OR CARRILLO,ESCUELA ESTADAL CONCENTRADA EL RIECITO,N/A,272,206,206,202,4,N/A,1,0,0,0,1,10,191
EDO. TRUJILLO,CE. TRUJILLO,PQ. MONSE#OR CARRILLO,ESCUELA CONCENTRADA LOMA DE PIEDRAS NEGRAS,N/A,149,144,144,142,2,N/A,1,0,0,1,0,9,132
EDO. TRUJILLO,CE. TRUJILLO,PQ. MONSE#OR CARRILLO,UNIDAD EDUCATIVA MONSEÑOR ESTANISLAO CARRILLO,N/A,2743,2233,2233,2177,56,N/A,5,0,0,3,15,804,1355
EDO. TRUJILLO,CE. TRUJILLO,PQ. MONSE#OR CARRILLO,ESCUELA CONCENTRADA ESTADAL PÁRAMO DE ORTÍZ,N/A,282,213,213,209,4,N/A,1,0,0,0,0,56,153
EDO. TRUJILLO,CE. TRUJILLO,PQ. MONSE#OR CARRILLO,UNIDAD EDUCATIVA MONSEÑOR VICENTE VALERO MARQUEZ,N/A,277,185,185,184,1,N/A,1,0,0,0,0,12,172
EDO. TRUJILLO,CE. TRUJILLO,PQ. MONSE#OR CARRILLO,ESCUELA BOLIVARIANA TIMIRISIS,N/A,372,289,289,286,3,N/A,1,0,0,0,4,38,244
EDO. TRUJILLO,CE. TRUJILLO,PQ. MONSE#OR CARRILLO,UNIDAD EDUCATIVA MARÍA BARTOLA BECERRA,N/A,1235,964,964,947,17,N/A,3,0,1,1,4,223,718
EDO. TRUJILLO,CE. TRUJILLO,PQ. CHIQUINQUIRA,ESCUELA BOLIVARIANA ESTADO CARABOBO,N/A,2905,2327,2327,2290,37,N/A,5,0,0,1,5,1033,1251
EDO. TRUJILLO,CE. TRUJILLO,PQ. CHIQUINQUIRA,ESCUELA BOLIVARIANA MANUELA SAENZ,N/A,184,156,156,153,3,N/A,1,0,0,0,2,23,128
EDO. TRUJILLO,CE. TRUJILLO,PQ. CHIQUINQUIRA,COLEGIO NUESTRA SEÑORA DE COROMOTO,N/A,465,417,417,414,3,N/A,1,0,1,0,0,317,96
EDO. TRUJILLO,CE. TRUJILLO,PQ. CHIQUINQUIRA,ESCUELA ESTADAL CONCENTRADA OCANTO,N/A,378,291,291,285,6,N/A,1,0,0,0,4,65,216
EDO. TRUJILLO,CE. TRUJILLO,PQ. CHIQUINQUIRA,UNIDAD EDUCATIVA ROSARIO CARRILLO HEREDIA,N/A,1641,1324,1324,1304,20,N/A,3,0,0,1,8,480,815
EDO. TRUJILLO,CE. TRUJILLO,PQ. CHIQUINQUIRA,ESCUELA BÁSICA PREBISTERO RAFAEL MARÍA VILLASMIL,N/A,1737,1472,1472,1447,25,N/A,3,0,1,0,10,610,826
EDO. TRUJILLO,CE. TRUJILLO,PQ. CHIQUINQUIRA,ESCUELA CONCENTRADA EL ALGARROBO,N/A,127,107,107,107,0,N/A,1,0,0,1,0,15,91
EDO. TRUJILLO,CE. TRUJILLO,PQ. CRISTOBAL MENDOZA,CARCEL NACIONAL,N/A,589,185,185,181,4,N/A,1,0,1,0,1,35,144
EDO. TRUJILLO,CE. TRUJILLO,PQ. CRISTOBAL MENDOZA,ESCUELA ESTADAL LOMA DE CORONADO NER 547,N/A,209,158,158,154,4,N/A,1,0,0,0,1,51,102
EDO. TRUJILLO,CE. TRUJILLO,PQ. CRISTOBAL MENDOZA,ESCUELA CONCENTRADA BARBARITA DE LA TORRE,N/A,116,113,113,106,7,N/A,1,0,0,0,2,23,81
EDO. TRUJILLO,CE. TRUJILLO,PQ. CRISTOBAL MENDOZA,CENTRO DE EDUCACIÓN TRUJILLO,N/A,2494,2047,2047,2025,22,N/A,5,0,3,0,12,825,1185
EDO. TRUJILLO,CE. TRUJILLO,PQ. CRISTOBAL MENDOZA,ESCUELA ESTADAL CONCENTRADA DOÑA ESTEFANÍA MORÓN DE RUMBOS,N/A,198,136,136,133,3,N/A,1,0,0,0,0,42,91
EDO. TRUJILLO,CE. TRUJILLO,PQ. CRISTOBAL MENDOZA,ESCUELA BOLIVARIANA AMÉRICO BRICEÑO VALERO,N/A,2395,1924,1924,1885,39,N/A,5,0,1,0,6,800,1078
EDO. TRUJILLO,CE. TRUJILLO,PQ. CRISTOBAL MENDOZA,ESCUELA CONCENTRADA EL LIMON,N/A,109,101,101,100,1,N/A,1,0,0,0,0,23,77
EDO. TRUJILLO,CE. TRUJILLO,PQ. CRISTOBAL MENDOZA,ESCUELA BOLIVARIANA LA TUNITA,N/A,1549,1311,1311,1288,23,N/A,3,0,1,0,10,429,848
EDO. TRUJILLO,CE. TRUJILLO,PQ. CRISTOBAL MENDOZA,ESCUELA BOLIVARIANA EL HATÍCO,N/A,462,413,413,407,6,N/A,1,0,1,0,0,118,288
EDO. TRUJILLO,CE. TRUJILLO,PQ. CRISTOBAL MENDOZA,ESCUELA BOLIVARIANA CARRILLO GUERRA,N/A,3141,2607,2607,2576,31,N/A,6,0,2,1,7,1065,1501
EDO. TRUJILLO,CE. TRUJILLO,PQ. CRUZ CARRILLO,ESCUELA BOLIVARIANA CAPELLANIAS,N/A,309,232,232,229,3,N/A,1,0,2,0,2,46,179
EDO. TRUJILLO,CE. TRUJILLO,PQ. CRUZ CARRILLO,ESCUELA ESTADAL CONCENTRADA LLANO GRANDE,N/A,211,137,137,134,3,N/A,1,0,0,1,0,6,127
EDO. TRUJILLO,CE. TRUJILLO,PQ. CRUZ CARRILLO,ESCUELA ESTADAL 160 PÁRAMO DE MISISI,N/A,N/A,N/A,N/A,N/A,N/A,N/A,N/A,N/A,N/A,N/A,N/A,N/A,N/A
EDO. TRUJILLO,CE. TRUJILLO,PQ. CRUZ CARRILLO,ESCUELA BOLIVARIANA TOBÍAS VALERA MARTÍNEZ,N/A,1097,938,938,919,19,N/A,2,0,0,0,2,426,491
EDO. TRUJILLO,CE. TRUJILLO,PQ. CRUZ CARRILLO,ESCUELA ESTADAL CONCENTRADA MOCOY ABAJO,N/A,349,251,251,247,4,N/A,1,0,0,0,2,50,195
EDO. TRUJILLO,CE. TRUJILLO,PQ. CRUZ CARRILLO,ESCUELA ESTADAL CONCENTRADA LA CUCHILLA DE SIQUISAY,N/A,94,71,71,70,1,N/A,1,0,0,0,1,14,55
EDO. TRUJILLO,CE. TRUJILLO,PQ. CRUZ CARRILLO,ESCUELA BOLIVARIANA PADRE RASQUIN,N/A,1296,1108,1108,1097,11,N/A,3,0,1,0,3,590,503
EDO. TRUJILLO,MP. CARACHE,PQ. CUICAS,UNIDAD EDUCATIVA ESTADAL JAPAZ,N/A,365,274,274,274,0,N/A,1,0,0,1,0,98,175
EDO. TRUJILLO,MP. CARACHE,PQ. CUICAS,ESCUELA BOLIVARIANA PALMAS REALES,N/A,186,145,145,144,1,N/A,1,0,0,1,0,19,124
EDO. TRUJILLO,MP. CARACHE,PQ. CUICAS,ESCUELA BOLIVARIANA PALMIRA,N/A,91,80,80,79,1,N/A,1,0,0,0,0,8,71
EDO. TRUJILLO,MP. CARACHE,PQ. CUICAS,SALON DE LECTURA ROSARIO MONTERO DE MORON,N/A,94,64,64,62,2,N/A,1,0,0,0,1,22,39
EDO. TRUJILLO,MP. CARACHE,PQ. CUICAS,ESCUELA BOLIVARIANA EL HELECHAL,N/A,221,158,158,158,0,N/A,1,0,0,0,0,14,144
EDO. TRUJILLO,MP. CARACHE,PQ. CUICAS,ESCUELA BOLIVARIANA EL CUMBE,N/A,365,277,277,275,2,N/A,1,0,0,0,1,28,246
EDO. TRUJILLO,MP. CARACHE,PQ. CUICAS,ESCUELA ESTADAL CONCENTRADA VENTILACIÓN,N/A,114,85,85,85,0,N/A,1,0,0,0,1,4,80
EDO. TRUJILLO,MP. CARACHE,PQ. CUICAS,ESCUELA NACIONAL CONCENTRADA BOLIVARIANA JOSE EULOGIO FERNÁNDEZ,N/A,238,158,158,158,0,N/A,1,0,0,1,1,8,148
EDO. TRUJILLO,MP. CARACHE,PQ. CUICAS,LICEO BOLIVARIANO ANTONIO JOSÉ SALDIVIA,N/A,1066,738,738,725,13,N/A,2,0,1,0,4,304,416
EDO. TRUJILLO,MP. CARACHE,PQ. CUICAS,UNIDAD EDUCATIVA ESTADAL CONCENTRADA NUMERO 99 S N CASA DE ZINC,N/A,62,55,55,55,0,N/A,1,0,0,0,0,7,48
EDO. TRUJILLO,MP. CARACHE,PQ. CUICAS,UNIDAD EDUCATIVA RAFAEL ANTONIO CAÑIZALES,N/A,443,317,317,314,3,N/A,1,0,0,0,0,46,268
EDO. TRUJILLO,MP. CARACHE,PQ. CUICAS,ESCUELA BOLIVARIANA DOCTOR SEIJAS,N/A,239,152,152,149,3,N/A,1,0,0,0,0,25,124
EDO. TRUJILLO,MP. CARACHE,PQ. CUICAS,ESCUELA BOLIVARIANA SAN JUAN DE CUICAS,N/A,226,144,144,143,1,N/A,1,0,0,0,0,17,126
EDO. TRUJILLO,MP. CARACHE,PQ. CUICAS,ESCUELA ESTADAL CONCENTRADA EL VIGIA,N/A,225,178,178,176,2,N/A,1,0,0,0,0,20,156
EDO. TRUJILLO,MP. CARACHE,PQ. CUICAS,ESCUELA BOLIVARIANA MONSEÑOR LUÍS PARDO MANCILLA,N/A,356,272,272,268,4,N/A,1,0,0,0,1,33,234
EDO. TRUJILLO,MP. CARACHE,PQ. CUICAS,ESCUELA BOLIVRIANA ARENALES,N/A,88,74,74,74,0,N/A,1,0,0,0,0,14,60
EDO. TRUJILLO,MP. CARACHE,PQ. CUICAS,ESCUELA ASOCIACIÓN DE PROMOCIÓN DE LA EDUCACIÓN POPULAR SIMÓN BOLÍVAR,N/A,313,264,264,261,3,N/A,1,0,0,1,4,99,157
EDO. TRUJILLO,MP. CARACHE,PQ. CUICAS,UNIDAD EDUCATIVA BÁSICA CONCENTRADA NÚMERO 207 238,N/A,235,171,171,166,5,N/A,1,0,0,0,1,22,143
EDO. TRUJILLO,MP. CARACHE,PQ. CUICAS,ESCUELA BOLIVARIANA EL JUMANGAL,N/A,135,96,96,95,1,N/A,1,0,0,0,0,25,70
EDO. TRUJILLO,MP. CARACHE,PQ. SANTA CRUZ,ESCUELA ESTADAL EZEQUIEL ZAMORA NER 110,N/A,229,212,212,205,7,N/A,1,0,0,0,2,11,192
EDO. TRUJILLO,MP. CARACHE,PQ. SANTA CRUZ,ESCUELA CONCENTRADA SIN NÚMERO  MONGON,N/A,236,178,178,176,2,N/A,1,0,0,0,1,33,142
EDO. TRUJILLO,MP. CARACHE,PQ. SANTA CRUZ,ESCUELA CONCENTRADA  SIN NÚMERO EL FUNDO,N/A,362,277,277,266,11,N/A,1,0,1,0,0,75,190
EDO. TRUJILLO,MP. CARACHE,PQ. SANTA CRUZ,UNIDAD EDUCATIVA ESTADAL AÑO INTERNACIONAL DEL NIÑO,N/A,840,636,636,615,21,N/A,2,0,0,0,5,170,440
EDO. TRUJILLO,MP. CARACHE,PQ. SANTA CRUZ,ESCUELA ESTADAL CONCENTRADA SIN NÚMERO SANTO DOMINGO,N/A,107,85,85,85,0,N/A,1,0,0,0,0,23,62
EDO. TRUJILLO,MP. CARACHE,PQ. PANAMERICANA,ESCUELA TECNICA AGROPECUARIA ROBINZONIANA DR ZUI BREWER GROSS,N/A,86,73,73,73,0,N/A,1,0,0,0,1,15,57
EDO. TRUJILLO,MP. CARACHE,PQ. PANAMERICANA,UNIDA EDUCATIVA SAN MIGUEL,N/A,96,94,94,93,1,N/A,1,0,0,0,0,1,92
EDO. TRUJILLO,MP. CARACHE,PQ. PANAMERICANA,UNIDAD EDUCATIVA ESTADAL MIGUEL ENRIQUE GUDIÑO,N/A,804,645,645,633,12,N/A,2,0,0,0,2,102,529
EDO. TRUJILLO,MP. CARACHE,PQ. PANAMERICANA,ESCUELA BOLIVARIANA SAN FELIPE,N/A,220,183,183,180,3,N/A,1,0,0,0,3,18,159
EDO. TRUJILLO,MP. CARACHE,PQ. PANAMERICANA,ESCUELA BOLIVARIANA PARAMITO CALIENTE,N/A,521,418,418,416,2,N/A,1,0,0,1,1,42,372
EDO. TRUJILLO,MP. CARACHE,PQ. PANAMERICANA,UNIDAD EDUCATIVA CAMILO CAÑIZALES,N/A,190,171,171,169,2,N/A,1,0,0,0,1,13,155
EDO. TRUJILLO,MP. CARACHE,PQ. LA CONCEPCION,ESCUELA UNITARIA ESTADAL EL POTRERO,N/A,88,70,70,70,0,N/A,1,0,0,0,0,1,69
EDO. TRUJILLO,MP. CARACHE,PQ. LA CONCEPCION,ESCUELA BOLIVARIANA MIQUIMU,N/A,223,182,182,179,3,N/A,1,0,0,0,1,59,119
EDO. TRUJILLO,MP. CARACHE,PQ. LA CONCEPCION,ESCUELA BOLIVARIANA MESA POSTRERA,N/A,187,144,144,143,1,N/A,1,0,0,0,0,59,84
EDO. TRUJILLO,MP. CARACHE,PQ. LA CONCEPCION,ESCUELA BOLIVARIANA QUEBRADA DE AGUA,N/A,421,296,296,289,7,N/A,1,0,0,1,1,33,254
EDO. TRUJILLO,MP. CARACHE,PQ. LA CONCEPCION,ESCUELA BOLIVARIANA MIQUIA ABAJO,N/A,236,189,189,188,1,N/A,1,0,0,0,1,3,184
EDO. TRUJILLO,MP. CARACHE,PQ. LA CONCEPCION,ESCUELA BOLIVARIANA BITICUY LAS COCUIZAS,N/A,179,163,163,162,1,N/A,1,1,0,0,0,4,157
EDO. TRUJILLO,MP. CARACHE,PQ. LA CONCEPCION,SALÓN DE LECTURA PADRE VASQUÉZ,N/A,222,189,189,186,3,N/A,1,0,0,0,0,49,137
EDO. TRUJILLO,MP. CARACHE,PQ. LA CONCEPCION,ESCUELA BOLIVARIANA MIQUIA ARRIBA,N/A,551,403,403,398,5,N/A,1,0,1,0,1,62,334
EDO. TRUJILLO,MP. CARACHE,PQ. LA CONCEPCION,ESCUELA CONCENTRADA EL POTRERITO,N/A,141,96,96,94,2,N/A,1,0,0,0,1,9,84
EDO. TRUJILLO,MP. CARACHE,PQ. LA CONCEPCION,ESCUELA ESTADAL EL RINCON,N/A,98,85,85,84,1,N/A,1,0,0,0,0,5,79
EDO. TRUJILLO,MP. CARACHE,PQ. LA CONCEPCION,ESCUELA BOLIVARIANA EL POLIPODIO,N/A,96,92,92,89,3,N/A,1,0,0,1,1,6,81
EDO. TRUJILLO,MP. CARACHE,PQ. LA CONCEPCION,ESCUELA BOLIVARIANA RIO ARRIBA,N/A,214,186,186,184,2,N/A,1,0,0,0,0,30,154
EDO. TRUJILLO,MP. CARACHE,PQ. LA CONCEPCION,UNIDAD EDUCATIVA NACIONAL GUADALUPE ROMÁN COLMENARES,N/A,870,706,706,700,6,N/A,2,0,0,0,0,173,527
EDO. TRUJILLO,MP. CARACHE,PQ. LA CONCEPCION,ESCUELA ESTADAL CONCENTRADA QUEBRADA ARRIBA,N/A,188,155,155,154,1,N/A,1,0,0,0,0,16,138
EDO. TRUJILLO,MP. CARACHE,PQ. LA CONCEPCION,ESCUELA BOLIVARIANA SISI,N/A,189,130,130,130,0,N/A,1,0,0,0,1,7,122
EDO. TRUJILLO,MP. CARACHE,PQ. CARACHE,COMPLEJO CULTURAL CARACHY,N/A,924,732,732,711,21,N/A,2,0,0,0,1,254,456
EDO. TRUJILLO,MP. CARACHE,PQ. CARACHE,CENTRO DE EDUCACION INICIAL EL SAMAN,N/A,208,166,166,159,7,N/A,1,0,0,0,0,66,93
EDO. TRUJILLO,MP. CARACHE,PQ. CARACHE,ESCUELA BOLIVARIANA MESA ARRIBA,N/A,499,360,360,349,11,N/A,1,0,0,0,4,96,249
EDO. TRUJILLO,MP. CARACHE,PQ. CARACHE,ESCUELA BOLIVARIANA AGUA DE OBISPO,N/A,65,40,40,40,0,N/A,1,1,0,0,0,8,31
EDO. TRUJILLO,MP. CARACHE,PQ. CARACHE,ESCUELA BOLIVARIANA LAS PALMAS,N/A,98,78,78,77,1,N/A,1,0,0,0,0,5,72
EDO. TRUJILLO,MP. CARACHE,PQ. CARACHE,ESCUELA ESTADAL UNITARIA LAS PEÑITAS,N/A,110,83,83,83,0,N/A,1,0,0,0,1,14,68
EDO. TRUJILLO,MP. CARACHE,PQ. CARACHE,ESCUELA NACIONAL GRADUADA LA PLAYA,N/A,722,561,561,551,10,N/A,2,0,0,0,4,206,341
EDO. TRUJILLO,MP. CARACHE,PQ. CARACHE,ESCUELA BOLIVARIANA CARACHE,N/A,616,468,468,453,15,N/A,2,0,0,0,3,149,301
EDO. TRUJILLO,MP. CARACHE,PQ. CARACHE,ESCUELA BOLIVARIANA LA UNIÓN,N/A,248,195,195,195,0,N/A,1,0,0,0,0,53,142
EDO. TRUJILLO,MP. CARACHE,PQ. CARACHE,ESCUELA BOLIVARIANA CAHINGO,N/A,111,102,102,101,1,N/A,1,0,0,0,0,5,96
EDO. TRUJILLO,MP. CARACHE,PQ. CARACHE,ESCUELA ESTADAL CONCENTRADA EL CORTIJO NÚMERO 308,N/A,155,101,101,101,0,N/A,1,0,0,1,0,6,94
EDO. TRUJILLO,MP. CARACHE,PQ. CARACHE,ESCUELA BOLIVARIANA EL POTRERO,N/A,80,69,69,69,0,N/A,1,0,0,0,0,5,64
EDO. TRUJILLO,MP. CARACHE,PQ. CARACHE,ESCUELA BOLIVARIANA DOCTOR ERNERT,N/A,1121,872,872,847,25,N/A,2,0,0,1,7,376,463
EDO. TRUJILLO,MP. CARACHE,PQ. CARACHE,CENTRO DE EDUCACIÓN INICIAL SIMONCITO DOCTOR ERNST,N/A,1055,806,806,790,16,N/A,2,0,0,0,2,364,424
EDO. TRUJILLO,MP. CARACHE,PQ. CARACHE,ESCUELA ESTADAL UNITARIA LA LAGUNETA,N/A,109,81,81,81,0,N/A,1,0,0,0,1,36,44
EDO. TRUJILLO,MP. CARACHE,PQ. CARACHE,ESCUELA BOLIVARIANA RIO ABAJO,N/A,130,99,99,98,1,N/A,1,0,0,0,2,40,56
EDO. TRUJILLO,MP. CARACHE,PQ. CARACHE,ESCUELA BOLIVARIANA LAS ADJUNTAS,N/A,277,202,202,200,2,N/A,1,0,0,0,0,76,124
EDO. TRUJILLO,MP. CARACHE,PQ. CARACHE,ESCUELA BOLIVARIANA LA PEÑA,N/A,238,186,186,185,1,N/A,1,0,0,0,1,11,173
EDO. TRUJILLO,MP. CARACHE,PQ. CARACHE,ESCUELA ESTADAL LOMA DEL MEDIO,N/A,117,104,104,101,3,N/A,1,0,0,0,0,5,96
EDO. TRUJILLO,MP. CARACHE,PQ. CARACHE,ESCUELA BOLIVARIANA MIQUIMBAY,N/A,146,105,105,102,3,N/A,1,1,0,1,0,14,86
EDO. TRUJILLO,MP. CARACHE,PQ. CARACHE,LICEO BOLIVARIANO JUAN ANTONIO ROMÁN VALECILLOS,N/A,1747,1373,1373,1346,27,N/A,3,0,0,1,5,595,745
EDO. TRUJILLO,MP. CARACHE,PQ. CARACHE,ESCUELA BOLIVARIANA LA MORITA,N/A,386,293,293,287,6,N/A,1,0,0,0,1,97,189
EDO. TRUJILLO,MP. CANDELARIA,PQ. MANUEL SALVADOR ULLOA,UNIDAD EDUCATIVA DR AMILCAR FONSECA,N/A,1613,1187,1187,1154,33,N/A,3,0,0,0,4,194,956
EDO. TRUJILLO,MP. CANDELARIA,PQ. CARRILLO,ESCUELA BOLIVARIANA MOGOTON,N/A,88,67,67,66,1,N/A,1,0,0,0,0,3,63
EDO. TRUJILLO,MP. CANDELARIA,PQ. CARRILLO,ESCUELA BOLIVARIANA SAN PEDRO,N/A,353,271,271,268,3,N/A,1,0,0,0,0,54,214
EDO. TRUJILLO,MP. CANDELARIA,PQ. CARRILLO,ESCUELA ESTADAL CONCENTRADA CRUZ VERDE,N/A,275,185,185,185,0,N/A,1,0,0,0,0,62,123
EDO. TRUJILLO,MP. CANDELARIA,PQ. CARRILLO,ESCUELA BOLIVARIANA ANTONIO JOSÉ PACHECO,N/A,950,694,694,685,9,N/A,2,0,0,0,1,160,524
EDO. TRUJILLO,MP. CANDELARIA,PQ. CARRILLO,UNIDAD EDUCATIVA NUMERO 111 438 EL GUARAMACAL,N/A,113,85,85,85,0,N/A,1,0,0,0,0,6,79
EDO. TRUJILLO,MP. CANDELARIA,PQ. ARNOLDO GABALDON,UNIDAD EDUCATIVA ANTONIO JOSE MENDOZA,N/A,630,493,493,489,4,N/A,2,0,0,0,3,58,428
EDO. TRUJILLO,MP. CANDELARIA,PQ. ARNOLDO GABALDON,ESCUELA GRADUADA ERNESTO JOSE RENGIFO,N/A,N/A,N/A,N/A,N/A,N/A,N/A,N/A,N/A,N/A,N/A,N/A,N/A,N/A
EDO. TRUJILLO,MP. CANDELARIA,PQ. ARNOLDO GABALDON,ESCUELA ESTADAL CONCENTRADA LAS INVACIONES,N/A,34,29,29,29,0,N/A,1,0,0,0,0,4,25
EDO. TRUJILLO,MP. CANDELARIA,PQ. ARNOLDO GABALDON,ESCUELA BOLIVARIANA MINAS DE MONAY,N/A,1359,1084,1084,1070,14,N/A,3,1,0,0,2,187,880
EDO. TRUJILLO,MP. CANDELARIA,PQ. CEGARRA,ESCUELA BOLIVARIANA ROBERTO GABALDON IRRAGORRY,N/A,767,574,574,568,6,N/A,2,0,0,0,2,137,429
EDO. TRUJILLO,MP. CANDELARIA,PQ. CEGARRA,ESCUELA ESTADAL NO 325,N/A,104,68,68,66,2,N/A,1,0,0,0,0,12,54
EDO. TRUJILLO,MP. CANDELARIA,PQ. SAN JOSE,ESCUELA BOLIVARIANA FRANCISCA FERRINI VELAZCO,N/A,2503,1958,1958,1936,22,N/A,5,0,0,2,9,275,1650
EDO. TRUJILLO,MP. CANDELARIA,PQ. BOLIVIA,ESCUELA BOLIVARIANA LOS PANTANOS,N/A,209,153,153,148,5,N/A,1,0,0,0,0,21,127
EDO. TRUJILLO,MP. CANDELARIA,PQ. BOLIVIA,ESCUELA BOLIVARIANA PIEDRA AZUL,N/A,67,54,54,54,0,N/A,1,0,0,0,0,13,41
EDO. TRUJILLO,MP. CANDELARIA,PQ. BOLIVIA,ESCUELA BOLIVARIANA MOROMOY,N/A,208,163,163,158,5,N/A,1,0,0,0,5,34,119
EDO. TRUJILLO,MP. CANDELARIA,PQ. BOLIVIA,COMEDOR ESCOLAR UNIDAD BASICA BOLIVIA,N/A,88,72,72,70,2,N/A,1,0,0,0,0,19,51
EDO. TRUJILLO,MP. CANDELARIA,PQ. BOLIVIA,ESCUELA UNITARIA ESTADAL EL CARDONAL,N/A,67,41,41,41,0,N/A,1,0,0,0,0,15,26
EDO. TRUJILLO,MP. CANDELARIA,PQ. BOLIVIA,ESCUELA ESTADAL UNITARIA NUMERO 332 CERRO DE PIEDRA,N/A,195,154,154,152,2,N/A,1,0,0,0,0,9,143
EDO. TRUJILLO,MP. CANDELARIA,PQ. BOLIVIA,UNIDAD EDUCATIVA LA LAGUNETA,N/A,311,240,240,240,0,N/A,1,0,0,0,0,53,187
EDO. TRUJILLO,MP. CANDELARIA,PQ. BOLIVIA,ESCUELA BOLIVARIANA BOLIVIA,N/A,509,407,407,406,1,N/A,1,0,0,2,2,81,321
EDO. TRUJILLO,MP. CANDELARIA,PQ. BOLIVIA,ESCUELA BOLIVARIANA LOMA DE BOLIVIA,N/A,240,170,170,167,3,N/A,1,0,0,0,1,21,145
EDO. TRUJILLO,MP. CANDELARIA,PQ. BOLIVIA,ESCUELA ESTADAL NUMERO 41,N/A,208,140,140,138,2,N/A,1,0,0,0,0,16,122
EDO. TRUJILLO,MP. CANDELARIA,PQ. BOLIVIA,ESCUELA ESTADAL SUPERNUMERARIA,N/A,327,245,245,244,1,N/A,1,0,0,0,1,27,216
EDO. TRUJILLO,MP. CANDELARIA,PQ. CHEJENDE,ESCUELA BOLIVARIANA RIÓ SECO NUCLEO ESCOLAR RURAL 172,N/A,401,317,317,315,2,N/A,1,0,0,0,1,36,278
EDO. TRUJILLO,MP. CANDELARIA,PQ. CHEJENDE,ESCUELA CONCENTRADA LOS CUMBITOS,N/A,140,128,128,127,1,N/A,1,0,0,0,3,30,94
EDO. TRUJILLO,MP. CANDELARIA,PQ. CHEJENDE,COMPLEJO EDUCATIVO CRISTOBAL MENDOZA,N/A,521,389,389,383,6,N/A,1,0,0,0,0,140,243
EDO. TRUJILLO,MP. CANDELARIA,PQ. CHEJENDE,ESCUELA CONCENTRADA EL MONTANON,N/A,71,60,60,58,2,N/A,1,0,0,0,1,7,50
EDO. TRUJILLO,MP. CANDELARIA,PQ. CHEJENDE,ESCUELA BOLIVARIANA GUAMAS DE MONAY,N/A,1313,1016,1016,997,19,N/A,3,1,0,1,4,139,852
EDO. TRUJILLO,MP. CANDELARIA,PQ. CHEJENDE,UNIDAD EDUCATIVA NARIGUETE NUMERO 50 NER 176,N/A,213,168,168,166,2,N/A,1,0,0,0,0,79,87
EDO. TRUJILLO,MP. CANDELARIA,PQ. CHEJENDE,ESCUELA BOLIVARIANA SABANA LARGA,N/A,209,186,186,185,1,N/A,1,0,0,0,4,49,132
EDO. TRUJILLO,MP. CANDELARIA,PQ. CHEJENDE,ESCUELA ESTADAL SN,N/A,96,67,67,65,2,N/A,1,0,0,0,0,26,39
EDO. TRUJILLO,MP. CANDELARIA,PQ. CHEJENDE,ESCUELA ESTADAL CONCENTRADA SIN NUMERO  LA VICIOSA,N/A,398,317,317,312,5,N/A,1,0,0,1,2,86,223
EDO. TRUJILLO,MP. CANDELARIA,PQ. CHEJENDE,UNIDAD EDUCATIVA CHEJENDE,N/A,319,250,250,242,8,N/A,1,0,0,0,1,105,136
EDO. TRUJILLO,MP. CANDELARIA,PQ. CHEJENDE,ESCUELA BOLIVARIANA LA PREGONERA,N/A,220,130,130,129,1,N/A,1,0,0,0,1,10,118
EDO. TRUJILLO,MP. CANDELARIA,PQ. CHEJENDE,UNIDAD EDUCATIVA MARIA ELECTA TORRES,N/A,301,268,268,267,1,N/A,1,0,0,0,1,23,243
EDO. TRUJILLO,MP. CANDELARIA,PQ. CHEJENDE,UNIDAD EDUCATIVA EL BATATILLO,N/A,861,635,635,620,15,N/A,2,0,0,0,2,142,476
EDO. TRUJILLO,MP. CANDELARIA,PQ. CHEJENDE,UNIDAD EDUCATIVA SAN FELIPE,N/A,425,312,312,308,4,N/A,1,0,0,0,1,54,253
EDO. TRUJILLO,MP. CANDELARIA,PQ. CHEJENDE,UNIDAD EDUCATIVA FRANCISCO TORRES TORO,N/A,1014,769,769,745,24,N/A,2,0,1,0,2,140,602
EDO. TRUJILLO,MP. CANDELARIA,PQ. CHEJENDE,UNIDAD BASICA NUMERO 260 BITUBU,N/A,165,110,110,106,4,N/A,1,0,0,0,0,43,63
EDO. TRUJILLO,MP. CANDELARIA,PQ. CHEJENDE,ESCUELA BOLIVARIANA JOSE FELIPE MARQUEZ,N/A,1372,961,961,938,23,N/A,3,0,0,0,2,335,601
EDO. TRUJILLO,MP. CANDELARIA,PQ. CHEJENDE,ESCUELA BOLIVARIANA LAS MESETAS,N/A,103,88,88,85,3,N/A,1,0,0,0,2,14,69
EDO. TRUJILLO,MP. SUCRE,PQ. EL PARAISO,ESCUELA ESTADAL SIN NÚMERO EL PARAISO,N/A,244,184,184,180,4,N/A,1,0,0,0,0,54,126
EDO. TRUJILLO,MP. SUCRE,PQ. EL PARAISO,UNIDAD EDUCATIVA EL PARAISO,N/A,1087,757,757,741,16,N/A,2,0,0,0,0,235,506
EDO. TRUJILLO,MP. SUCRE,PQ. SABANA DE MENDOZA,ESCUELA CONCENTRADA NACIONAL SIMÓN BOLÍVAR NER 071,N/A,347,289,289,282,7,N/A,1,1,0,0,0,43,238
EDO. TRUJILLO,MP. SUCRE,PQ. SABANA DE MENDOZA,ESCUELA BOLIVARIANA GRAN MARISCAL ANTONIO JOSE DE SUCRE,N/A,360,289,289,285,4,N/A,1,0,0,0,1,59,225
EDO. TRUJILLO,MP. SUCRE,PQ. SABANA DE MENDOZA,UNIDAD BÁSICA MERCEDEZ DIAZ,N/A,2946,2389,2389,2346,43,N/A,5,0,1,0,10,1036,1299
EDO. TRUJILLO,MP. SUCRE,PQ. SABANA DE MENDOZA,CASA DE LA CULTURA DE SABANA DE MENDOZA,N/A,1372,1143,1143,1124,19,N/A,3,0,1,0,3,450,670
EDO. TRUJILLO,MP. SUCRE,PQ. SABANA DE MENDOZA,LICEO BOLIVARIANO CRUZ CARRILLLO,N/A,1640,1314,1314,1298,16,N/A,3,2,0,0,8,510,778
EDO. TRUJILLO,MP. SUCRE,PQ. SABANA DE MENDOZA,CENTRO DE EDUCACIÓN INICIAL SABANA DE MENDOZA,N/A,852,704,704,687,17,N/A,2,0,0,0,3,353,331
EDO. TRUJILLO,MP. SUCRE,PQ. JUNIN,UNIDAD BÁSICA 27 DE JUNIO DE 1870,N/A,2148,1705,1705,1686,19,N/A,4,0,0,0,2,517,1167
EDO. TRUJILLO,MP. SUCRE,PQ. JUNIN,ESCUELA GRADUADA RÓMULO BETANCOURT,N/A,554,429,429,426,3,N/A,1,0,0,0,1,140,285
EDO. TRUJILLO,MP. SUCRE,PQ. VALMORE RODRIGUEZ,COLEGIO MARISCAL ANTONIO JOSÉ DE SUCRE,N/A,3122,2563,2563,2522,41,N/A,6,3,0,1,6,879,1633
EDO. TRUJILLO,MP. SUCRE,PQ. VALMORE RODRIGUEZ,GIMNASIO CUBIERTO SABANA DE MENDOZA,N/A,1057,819,819,802,17,N/A,2,0,0,2,5,189,606
EDO. TRUJILLO,MP. SUCRE,PQ. VALMORE RODRIGUEZ,ESCUELA TÉCNICA ROBINSONIANA SABANA DE MENDOZA,N/A,236,214,214,207,7,N/A,1,0,0,0,0,10,197
EDO. TRUJILLO,MP. SUCRE,PQ. VALMORE RODRIGUEZ,UNIDAD EDUCATIVA VALMORE RODRIGUEZ,N/A,2730,2146,2146,2114,32,N/A,5,1,0,2,8,680,1423
EDO. TRUJILLO,MP. SUCRE,PQ. VALMORE RODRIGUEZ,ALDEA BOLIVARIANA MUNICIPIO SUCRE,N/A,655,526,526,516,10,N/A,2,0,0,0,2,64,450
EDO. TRUJILLO,MP. SUCRE,PQ. VALMORE RODRIGUEZ,UNIVERSIDAD PEDAGOGICA EXPERIMENTAL LIBERTADOR (UPEL),N/A,41,38,38,37,1,N/A,1,0,0,0,1,14,22
EDO. TRUJILLO,MP. PAMPAN,PQ. SANTA ANA,ESCUELA NACIONAL 540 EL ZAMURITO,N/A,273,204,204,201,3,N/A,1,0,0,0,0,17,184
EDO. TRUJILLO,MP. PAMPAN,PQ. SANTA ANA,ESCUELA BASICA SIN NUMERO COROZO DE SIQUISAY,N/A,135,112,112,112,0,N/A,1,0,0,0,0,2,110
EDO. TRUJILLO,MP. PAMPAN,PQ. SANTA ANA,ESCUELA CONCENTRADA LAS LAJAS,N/A,337,260,260,258,2,N/A,1,0,0,0,0,11,247
EDO. TRUJILLO,MP. PAMPAN,PQ. SANTA ANA,ESCUELA BOLIVARIANA LOS CORRALES,N/A,246,216,216,213,3,N/A,1,0,0,0,0,26,187
EDO. TRUJILLO,MP. PAMPAN,PQ. SANTA ANA,ESCUELA BOLIVARIANA SIQUISAY,N/A,388,294,294,291,3,N/A,1,0,0,0,2,48,241
EDO. TRUJILLO,MP. PAMPAN,PQ. SANTA ANA,ESCUELA ESTADAL CONCENTRADA,N/A,147,111,111,110,1,N/A,1,0,0,0,1,9,100
EDO. TRUJILLO,MP. PAMPAN,PQ. SANTA ANA,ESCUELA BOLIVARIANA 27 DE NOVIEMBRE DE 1820,N/A,2658,2050,2050,2022,28,N/A,5,1,1,0,6,588,1426
EDO. TRUJILLO,MP. PAMPAN,PQ. SANTA ANA,ESCUELA BOLIVARIANA LA BECERRERA,N/A,142,103,103,101,2,N/A,1,0,0,0,0,5,96
EDO. TRUJILLO,MP. PAMPAN,PQ. SANTA ANA,ESCUELA CONCENTRADA SIN NUMERO,N/A,270,201,201,197,4,N/A,1,0,0,1,1,9,186
EDO. TRUJILLO,MP. PAMPAN,PQ. SANTA ANA,UNIDAD EDUCATIVA BOLIVARIANA VITU,N/A,675,531,531,524,7,N/A,2,0,0,0,1,120,403
EDO. TRUJILLO,MP. PAMPAN,PQ. SANTA ANA,ESCUELA BOLIVARIANA EL LLANITO,N/A,238,221,221,215,6,N/A,1,0,0,0,0,50,165
EDO. TRUJILLO,MP. PAMPAN,PQ. SANTA ANA,ESCUELA ESTADAL CONCENTRADA NUMERO 305 EL COROZO,N/A,325,216,216,213,3,N/A,1,0,0,1,0,22,190
EDO. TRUJILLO,MP. PAMPAN,PQ. FLOR DE PATRIA,ESCUELA CONCENTRADA SIN NUMERO EL COROZAL,N/A,273,254,254,243,11,N/A,1,0,0,0,0,30,213
EDO. TRUJILLO,MP. PAMPAN,PQ. FLOR DE PATRIA,ESCUELA BOLIVARIANA EL VALLE,N/A,242,207,207,203,4,N/A,1,0,0,0,1,42,160
EDO. TRUJILLO,MP. PAMPAN,PQ. FLOR DE PATRIA,ESCUELA BOLIVARIANA LA VERA,N/A,214,177,177,174,3,N/A,1,0,0,0,0,28,146
EDO. TRUJILLO,MP. PAMPAN,PQ. FLOR DE PATRIA,ESCUELA BOLIVARIANA FERNÁNDO SEGNINI LUPI,N/A,1434,1149,1149,1124,25,N/A,3,1,0,0,5,300,818
EDO. TRUJILLO,MP. PAMPAN,PQ. FLOR DE PATRIA,ESCUELA BOLIVARIANA MONTAÑAS DE PERAZA,N/A,N/A,N/A,N/A,N/A,N/A,N/A,N/A,N/A,N/A,N/A,N/A,N/A,N/A
EDO. TRUJILLO,MP. PAMPAN,PQ. FLOR DE PATRIA,ESCUELA BOLIVARIANA FRANCISCO JAVIER URBINA,N/A,3339,2721,2721,2679,42,N/A,6,0,1,0,10,1134,1534
EDO. TRUJILLO,MP. PAMPAN,PQ. FLOR DE PATRIA,ESCUELA BÁSICA LA CONCENTRADA LA BETICÓ,N/A,320,239,239,232,7,N/A,1,0,0,0,0,31,201
EDO. TRUJILLO,MP. PAMPAN,PQ. FLOR DE PATRIA,NUCLEO ESCOLAR RURAL EL CAPUCAL,N/A,129,117,117,116,1,N/A,1,0,0,0,0,3,113
EDO. TRUJILLO,MP. PAMPAN,PQ. FLOR DE PATRIA,UNIDAD EDUCATIVA  ELVIA MONTILLA DE SANTOS,N/A,1066,913,913,889,24,N/A,2,0,0,0,2,337,550
EDO. TRUJILLO,MP. PAMPAN,PQ. FLOR DE PATRIA,ESCUELA UNITARIA CARACOLES,N/A,41,38,38,38,0,N/A,1,0,0,0,0,1,37
EDO. TRUJILLO,MP. PAMPAN,PQ. FLOR DE PATRIA,ESCUELA BOLIVARIANA DE EDUCACION ESPECIAL,N/A,2110,1758,1758,1712,46,N/A,4,1,0,1,6,661,1043
EDO. TRUJILLO,MP. PAMPAN,PQ. LA PAZ,ESCUELA BOLIVARIANA PUENTE BLANCO,N/A,126,111,111,105,6,N/A,1,0,0,0,0,20,85
EDO. TRUJILLO,MP. PAMPAN,PQ. LA PAZ,ESCUELA COCENTRADA LA GARITA NER 540,N/A,125,116,116,112,4,N/A,1,0,0,0,0,6,106
EDO. TRUJILLO,MP. PAMPAN,PQ. LA PAZ,ESCUELA ESTADAL LUCILA CORONADO,N/A,193,163,163,160,3,N/A,1,0,0,0,1,20,139
EDO. TRUJILLO,MP. PAMPAN,PQ. LA PAZ,ESCUELA BOLIVARIANA CAMPO ESTRELLA,N/A,445,354,354,347,7,N/A,1,0,0,1,4,30,312
EDO. TRUJILLO,MP. PAMPAN,PQ. LA PAZ,ALDEA BOLIVARIANA   LA PAZ,N/A,532,434,434,429,5,N/A,1,0,0,0,1,52,376
EDO. TRUJILLO,MP. PAMPAN,PQ. LA PAZ,SEDE DE PROTECCIÓN CIVIL,N/A,1120,856,856,825,31,N/A,2,1,0,0,4,214,606
EDO. TRUJILLO,MP. PAMPAN,PQ. LA PAZ,ESCUELA BOLIVARIANA SANTA LUCIA DE MONAY,N/A,638,505,505,499,6,N/A,2,0,0,0,3,95,401
EDO. TRUJILLO,MP. PAMPAN,PQ. LA PAZ,UNIDAD EDUCATIVA JOSÉ ANTONIO GALUE,N/A,1509,1139,1139,1118,21,N/A,3,0,0,0,10,184,924
EDO. TRUJILLO,MP. PAMPAN,PQ. LA PAZ,UNIDAD EDUCATIVA JOSEFINA PIMENTEL,N/A,3128,2473,2473,2403,70,N/A,6,1,0,2,7,746,1647
EDO. TRUJILLO,MP. PAMPAN,PQ. LA PAZ,ESCUELA  BOLIVARIANO EL MACOYAL,N/A,1266,987,987,968,19,N/A,3,0,0,1,5,138,824
EDO. TRUJILLO,MP. PAMPAN,PQ. LA PAZ,LICEO BOLIVARIANO MONAY,N/A,2404,1931,1931,1901,30,N/A,5,0,1,2,6,595,1297
EDO. TRUJILLO,MP. PAMPAN,PQ. PAMPAN,ESCUELA BOLIVARIANA LA CATALINA,N/A,248,169,169,165,4,N/A,1,0,0,0,0,14,151
EDO. TRUJILLO,MP. PAMPAN,PQ. PAMPAN,CENTRO RECREACIONAL Y DEPOTIVO PAMPÁN (PARQUE),N/A,108,93,93,88,5,N/A,1,0,0,0,1,46,41
EDO. TRUJILLO,MP. PAMPAN,PQ. PAMPAN,LICEO BOLIVARIANO RAFAEL MARIA URRECHEAGA,N/A,2424,2054,2054,2008,46,N/A,5,1,2,0,11,1002,992
EDO. TRUJILLO,MP. PAMPAN,PQ. PAMPAN,ESCUELA BOLIVARIANA LOS PAJONES,N/A,115,93,93,93,0,N/A,1,0,0,0,0,5,88
EDO. TRUJILLO,MP. PAMPAN,PQ. PAMPAN,ESCUELA BOLIVARIANA FRANCISCO DE SALES PÉREZ,N/A,3521,2862,2862,2805,57,N/A,7,0,0,0,16,1229,1560
EDO. TRUJILLO,MP. JUAN V CAMPO ELI,PQ. ARNOLDO GABALDON,ESCUELA ESTADAL CONCENTRADA N#55 LA CIMA,N/A,163,145,145,142,3,N/A,1,0,0,0,1,31,110
EDO. TRUJILLO,MP. JUAN V CAMPO ELI,PQ. ARNOLDO GABALDON,ESCUELA BOLIVARIANA NUMERO 06 EL MORRITO,N/A,271,211,211,208,3,N/A,1,0,0,0,1,41,166
EDO. TRUJILLO,MP. JUAN V CAMPO ELI,PQ. ARNOLDO GABALDON,ESCUELA ESTADAL UNITARIA N*431 LA CUCHILLA DE SAGUAS,N/A,87,65,65,64,1,N/A,1,0,0,0,0,10,54
EDO. TRUJILLO,MP. JUAN V CAMPO ELI,PQ. ARNOLDO GABALDON,ESCUELA BOLIVARIANA FÉLIX BEREBESI PÉREZ,N/A,378,282,282,276,6,N/A,1,1,0,0,0,17,258
EDO. TRUJILLO,MP. JUAN V CAMPO ELI,PQ. ARNOLDO GABALDON,UNIDAD EDUCATIVA ESTADAL CONCENTRADA NUMERO 26 TIERRA BLANCA,N/A,426,320,320,317,3,N/A,1,0,0,1,1,64,251
EDO. TRUJILLO,MP. JUAN V CAMPO ELI,PQ. ARNOLDO GABALDON,ESCUELA BOLIVARIANA LAS QUEBRADAS,N/A,485,359,359,353,6,N/A,1,0,0,0,0,67,286
EDO. TRUJILLO,MP. JUAN V CAMPO ELI,PQ. CAMPO ELIAS,ESCUELA BOLIVARIANA LA CUCHILLA DE CAMPO ELIAS,N/A,450,353,353,346,7,N/A,1,0,0,0,1,37,308
EDO. TRUJILLO,MP. JUAN V CAMPO ELI,PQ. CAMPO ELIAS,ESCUELA ESTADAL UNITARIA NUMERO 177 LA MORITA,N/A,363,318,318,311,7,N/A,1,1,0,2,1,44,263
EDO. TRUJILLO,MP. JUAN V CAMPO ELI,PQ. CAMPO ELIAS,ESCUELA BOLIVARIANA CUNAVICHE,N/A,364,300,300,295,5,N/A,1,0,0,0,1,27,267
EDO. TRUJILLO,MP. JUAN V CAMPO ELI,PQ. CAMPO ELIAS,ESCUELA BOLIVARIANA LOS APOSENTOS,N/A,131,125,125,124,1,N/A,1,0,0,0,0,9,115
EDO. TRUJILLO,MP. JUAN V CAMPO ELI,PQ. CAMPO ELIAS,ESCUELA BOLIVARIANA PORTILLO Y VALERA,N/A,2324,1888,1888,1860,28,N/A,4,0,2,0,5,645,1208
